[I 2024-05-20 20:14:27,292] Trial 97 finished with value: 0.8858315383225785 and parameters: {'num_neuronios': 31, 'num_camadas': 4, 'funcao_de_ativacao': 'ELU', 'taxa_de_aprendizado': 0.06657186650406446, 'otimizador': 'ADAM'}. Best is trial 84 with value: 0.7725181894480123.
GPU available: True (cuda), used: True
TPU available: False, using: 0 TPU cores
IPU available: False, using: 0 IPUs
HPU available: False, using: 0 HPUs
LOCAL_RANK: 0 - CUDA_VISIBLE_DEVICES: [0]

  | Name          | Type       | Params
---------------------------------------------
0 | todas_camadas | Sequential | 23.0 K
---------------------------------------------
23.0 K    Trainable params
0         Non-trainable params
23.0 K    Total params
0.092     Total estimated model params size (MB)
SLURM auto-requeueing enabled. Setting signal handlers.
/home/geovana23021/anaconda3/envs/ilumpy/lib/python3.11/site-packages/lightning/pytorch/loops/fit_loop.py:298: The number of training batches (13) is smaller than the logging interval Trainer(log_every_n_steps=50). Set a lower value for log_every_n_steps if you want to see logs for the training epoch.
`Trainer.fit` stopped: `max_epochs=55` reached.
/home/geovana23021/anaconda3/envs/ilumpy/lib/python3.11/site-packages/sklearn/metrics/_regression.py:483: FutureWarning: 'squared' is deprecated in version 1.4 and will be removed in 1.6. To calculate the root mean squared error, use the function'root_mean_squared_error'.
  warnings.warn(
[I 2024-05-20 20:14:43,870] Trial 98 finished with value: 1.0355370860480302 and parameters: {'num_neuronios': 76, 'num_camadas': 4, 'funcao_de_ativacao': 'ELU', 'taxa_de_aprendizado': 0.17487301917747716, 'otimizador': 'ADAM'}. Best is trial 84 with value: 0.7725181894480123.
GPU available: True (cuda), used: True
TPU available: False, using: 0 TPU cores
IPU available: False, using: 0 IPUs
HPU available: False, using: 0 HPUs
LOCAL_RANK: 0 - CUDA_VISIBLE_DEVICES: [0]

  | Name          | Type       | Params
---------------------------------------------
0 | todas_camadas | Sequential | 40.1 K
---------------------------------------------
40.1 K    Trainable params
0         Non-trainable params
40.1 K    Total params
0.161     Total estimated model params size (MB)
SLURM auto-requeueing enabled. Setting signal handlers.
/home/geovana23021/anaconda3/envs/ilumpy/lib/python3.11/site-packages/lightning/pytorch/loops/fit_loop.py:298: The number of training batches (13) is smaller than the logging interval Trainer(log_every_n_steps=50). Set a lower value for log_every_n_steps if you want to see logs for the training epoch.
`Trainer.fit` stopped: `max_epochs=55` reached.
/home/geovana23021/anaconda3/envs/ilumpy/lib/python3.11/site-packages/sklearn/metrics/_regression.py:483: FutureWarning: 'squared' is deprecated in version 1.4 and will be removed in 1.6. To calculate the root mean squared error, use the function'root_mean_squared_error'.
  warnings.warn(
[I 2024-05-20 20:14:59,536] Trial 99 finished with value: 1.0248250776249017 and parameters: {'num_neuronios': 104, 'num_camadas': 4, 'funcao_de_ativacao': 'ELU', 'taxa_de_aprendizado': 0.01018859417732991, 'otimizador': 'SGD'}. Best is trial 84 with value: 0.7725181894480123.
GPU available: True (cuda), used: True
TPU available: False, using: 0 TPU cores
IPU available: False, using: 0 IPUs
HPU available: False, using: 0 HPUs
LOCAL_RANK: 0 - CUDA_VISIBLE_DEVICES: [0]

  | Name          | Type       | Params
---------------------------------------------
0 | todas_camadas | Sequential | 12.0 K
---------------------------------------------
12.0 K    Trainable params
0         Non-trainable params
12.0 K    Total params
0.048     Total estimated model params size (MB)
SLURM auto-requeueing enabled. Setting signal handlers.
/home/geovana23021/anaconda3/envs/ilumpy/lib/python3.11/site-packages/lightning/pytorch/loops/fit_loop.py:298: The number of training batches (13) is smaller than the logging interval Trainer(log_every_n_steps=50). Set a lower value for log_every_n_steps if you want to see logs for the training epoch.
`Trainer.fit` stopped: `max_epochs=55` reached.
/home/geovana23021/anaconda3/envs/ilumpy/lib/python3.11/site-packages/sklearn/metrics/_regression.py:483: FutureWarning: 'squared' is deprecated in version 1.4 and will be removed in 1.6. To calculate the root mean squared error, use the function'root_mean_squared_error'.
  warnings.warn(
[I 2024-05-20 20:15:15,426] Trial 100 finished with value: 0.8769914883246891 and parameters: {'num_neuronios': 52, 'num_camadas': 4, 'funcao_de_ativacao': 'ELU', 'taxa_de_aprendizado': 0.04590728074729368, 'otimizador': 'ADAM'}. Best is trial 84 with value: 0.7725181894480123.
GPU available: True (cuda), used: True
TPU available: False, using: 0 TPU cores
IPU available: False, using: 0 IPUs
HPU available: False, using: 0 HPUs
LOCAL_RANK: 0 - CUDA_VISIBLE_DEVICES: [0]

  | Name          | Type       | Params
---------------------------------------------
0 | todas_camadas | Sequential | 29.7 K
---------------------------------------------
29.7 K    Trainable params
0         Non-trainable params
29.7 K    Total params
0.119     Total estimated model params size (MB)
SLURM auto-requeueing enabled. Setting signal handlers.
/home/geovana23021/anaconda3/envs/ilumpy/lib/python3.11/site-packages/lightning/pytorch/loops/fit_loop.py:298: The number of training batches (13) is smaller than the logging interval Trainer(log_every_n_steps=50). Set a lower value for log_every_n_steps if you want to see logs for the training epoch.
`Trainer.fit` stopped: `max_epochs=55` reached.
/home/geovana23021/anaconda3/envs/ilumpy/lib/python3.11/site-packages/sklearn/metrics/_regression.py:483: FutureWarning: 'squared' is deprecated in version 1.4 and will be removed in 1.6. To calculate the root mean squared error, use the function'root_mean_squared_error'.
  warnings.warn(
[I 2024-05-20 20:15:31,314] Trial 101 finished with value: 0.8747049346873765 and parameters: {'num_neuronios': 88, 'num_camadas': 4, 'funcao_de_ativacao': 'ELU', 'taxa_de_aprendizado': 0.02123316529851526, 'otimizador': 'ADAM'}. Best is trial 84 with value: 0.7725181894480123.
GPU available: True (cuda), used: True
TPU available: False, using: 0 TPU cores
IPU available: False, using: 0 IPUs
HPU available: False, using: 0 HPUs
LOCAL_RANK: 0 - CUDA_VISIBLE_DEVICES: [0]

  | Name          | Type       | Params
---------------------------------------------
0 | todas_camadas | Sequential | 18.9 K
---------------------------------------------
18.9 K    Trainable params
0         Non-trainable params
18.9 K    Total params
0.076     Total estimated model params size (MB)
SLURM auto-requeueing enabled. Setting signal handlers.
/home/geovana23021/anaconda3/envs/ilumpy/lib/python3.11/site-packages/lightning/pytorch/loops/fit_loop.py:298: The number of training batches (13) is smaller than the logging interval Trainer(log_every_n_steps=50). Set a lower value for log_every_n_steps if you want to see logs for the training epoch.
`Trainer.fit` stopped: `max_epochs=55` reached.
/home/geovana23021/anaconda3/envs/ilumpy/lib/python3.11/site-packages/sklearn/metrics/_regression.py:483: FutureWarning: 'squared' is deprecated in version 1.4 and will be removed in 1.6. To calculate the root mean squared error, use the function'root_mean_squared_error'.
  warnings.warn(
[I 2024-05-20 20:15:47,065] Trial 102 finished with value: 0.8608812376486439 and parameters: {'num_neuronios': 68, 'num_camadas': 4, 'funcao_de_ativacao': 'ELU', 'taxa_de_aprendizado': 0.014418109338225392, 'otimizador': 'ADAM'}. Best is trial 84 with value: 0.7725181894480123.
GPU available: True (cuda), used: True
TPU available: False, using: 0 TPU cores
IPU available: False, using: 0 IPUs
HPU available: False, using: 0 HPUs
LOCAL_RANK: 0 - CUDA_VISIBLE_DEVICES: [0]

  | Name          | Type       | Params
---------------------------------------------
0 | todas_camadas | Sequential | 8.1 K 
---------------------------------------------
8.1 K     Trainable params
0         Non-trainable params
8.1 K     Total params
0.032     Total estimated model params size (MB)
SLURM auto-requeueing enabled. Setting signal handlers.
/home/geovana23021/anaconda3/envs/ilumpy/lib/python3.11/site-packages/lightning/pytorch/loops/fit_loop.py:298: The number of training batches (13) is smaller than the logging interval Trainer(log_every_n_steps=50). Set a lower value for log_every_n_steps if you want to see logs for the training epoch.
`Trainer.fit` stopped: `max_epochs=55` reached.
/home/geovana23021/anaconda3/envs/ilumpy/lib/python3.11/site-packages/sklearn/metrics/_regression.py:483: FutureWarning: 'squared' is deprecated in version 1.4 and will be removed in 1.6. To calculate the root mean squared error, use the function'root_mean_squared_error'.
  warnings.warn(
[I 2024-05-20 20:16:02,788] Trial 103 finished with value: 0.824090234339021 and parameters: {'num_neuronios': 41, 'num_camadas': 4, 'funcao_de_ativacao': 'ELU', 'taxa_de_aprendizado': 0.008872558937471634, 'otimizador': 'ADAM'}. Best is trial 84 with value: 0.7725181894480123.
GPU available: True (cuda), used: True
TPU available: False, using: 0 TPU cores
IPU available: False, using: 0 IPUs
HPU available: False, using: 0 HPUs
LOCAL_RANK: 0 - CUDA_VISIBLE_DEVICES: [0]

  | Name          | Type       | Params
---------------------------------------------
0 | todas_camadas | Sequential | 4.9 K 
---------------------------------------------
4.9 K     Trainable params
0         Non-trainable params
4.9 K     Total params
0.020     Total estimated model params size (MB)
SLURM auto-requeueing enabled. Setting signal handlers.
/home/geovana23021/anaconda3/envs/ilumpy/lib/python3.11/site-packages/lightning/pytorch/loops/fit_loop.py:298: The number of training batches (13) is smaller than the logging interval Trainer(log_every_n_steps=50). Set a lower value for log_every_n_steps if you want to see logs for the training epoch.
`Trainer.fit` stopped: `max_epochs=55` reached.
/home/geovana23021/anaconda3/envs/ilumpy/lib/python3.11/site-packages/sklearn/metrics/_regression.py:483: FutureWarning: 'squared' is deprecated in version 1.4 and will be removed in 1.6. To calculate the root mean squared error, use the function'root_mean_squared_error'.
  warnings.warn(
[I 2024-05-20 20:16:18,192] Trial 104 finished with value: 0.8845881336340364 and parameters: {'num_neuronios': 30, 'num_camadas': 4, 'funcao_de_ativacao': 'ELU', 'taxa_de_aprendizado': 0.025708150212762383, 'otimizador': 'ADAM'}. Best is trial 84 with value: 0.7725181894480123.
GPU available: True (cuda), used: True
TPU available: False, using: 0 TPU cores
IPU available: False, using: 0 IPUs
HPU available: False, using: 0 HPUs
LOCAL_RANK: 0 - CUDA_VISIBLE_DEVICES: [0]

  | Name          | Type       | Params
---------------------------------------------
0 | todas_camadas | Sequential | 8.7 K 
---------------------------------------------
8.7 K     Trainable params
0         Non-trainable params
8.7 K     Total params
0.035     Total estimated model params size (MB)
SLURM auto-requeueing enabled. Setting signal handlers.
/home/geovana23021/anaconda3/envs/ilumpy/lib/python3.11/site-packages/lightning/pytorch/loops/fit_loop.py:298: The number of training batches (13) is smaller than the logging interval Trainer(log_every_n_steps=50). Set a lower value for log_every_n_steps if you want to see logs for the training epoch.
`Trainer.fit` stopped: `max_epochs=55` reached.
/home/geovana23021/anaconda3/envs/ilumpy/lib/python3.11/site-packages/sklearn/metrics/_regression.py:483: FutureWarning: 'squared' is deprecated in version 1.4 and will be removed in 1.6. To calculate the root mean squared error, use the function'root_mean_squared_error'.
  warnings.warn(
[I 2024-05-20 20:16:33,641] Trial 105 finished with value: 0.9402503899917019 and parameters: {'num_neuronios': 43, 'num_camadas': 4, 'funcao_de_ativacao': 'ELU', 'taxa_de_aprendizado': 0.009943154677602546, 'otimizador': 'RMSPROP'}. Best is trial 84 with value: 0.7725181894480123.
GPU available: True (cuda), used: True
TPU available: False, using: 0 TPU cores
IPU available: False, using: 0 IPUs
HPU available: False, using: 0 HPUs
LOCAL_RANK: 0 - CUDA_VISIBLE_DEVICES: [0]

  | Name          | Type       | Params
---------------------------------------------
0 | todas_camadas | Sequential | 14.8 K
---------------------------------------------
14.8 K    Trainable params
0         Non-trainable params
14.8 K    Total params
0.059     Total estimated model params size (MB)
SLURM auto-requeueing enabled. Setting signal handlers.
/home/geovana23021/anaconda3/envs/ilumpy/lib/python3.11/site-packages/lightning/pytorch/loops/fit_loop.py:298: The number of training batches (13) is smaller than the logging interval Trainer(log_every_n_steps=50). Set a lower value for log_every_n_steps if you want to see logs for the training epoch.
`Trainer.fit` stopped: `max_epochs=55` reached.
/home/geovana23021/anaconda3/envs/ilumpy/lib/python3.11/site-packages/sklearn/metrics/_regression.py:483: FutureWarning: 'squared' is deprecated in version 1.4 and will be removed in 1.6. To calculate the root mean squared error, use the function'root_mean_squared_error'.
  warnings.warn(
[I 2024-05-20 20:16:49,415] Trial 106 finished with value: 7.806147947445829 and parameters: {'num_neuronios': 59, 'num_camadas': 4, 'funcao_de_ativacao': 'ELU', 'taxa_de_aprendizado': 0.11870180055724162, 'otimizador': 'ADAM'}. Best is trial 84 with value: 0.7725181894480123.
GPU available: True (cuda), used: True
TPU available: False, using: 0 TPU cores
IPU available: False, using: 0 IPUs
HPU available: False, using: 0 HPUs
LOCAL_RANK: 0 - CUDA_VISIBLE_DEVICES: [0]

  | Name          | Type       | Params
---------------------------------------------
0 | todas_camadas | Sequential | 25.1 K
---------------------------------------------
25.1 K    Trainable params
0         Non-trainable params
25.1 K    Total params
0.100     Total estimated model params size (MB)
SLURM auto-requeueing enabled. Setting signal handlers.
/home/geovana23021/anaconda3/envs/ilumpy/lib/python3.11/site-packages/lightning/pytorch/loops/fit_loop.py:298: The number of training batches (13) is smaller than the logging interval Trainer(log_every_n_steps=50). Set a lower value for log_every_n_steps if you want to see logs for the training epoch.
`Trainer.fit` stopped: `max_epochs=55` reached.
/home/geovana23021/anaconda3/envs/ilumpy/lib/python3.11/site-packages/sklearn/metrics/_regression.py:483: FutureWarning: 'squared' is deprecated in version 1.4 and will be removed in 1.6. To calculate the root mean squared error, use the function'root_mean_squared_error'.
  warnings.warn(
[I 2024-05-20 20:17:05,236] Trial 107 finished with value: 0.89834348107564 and parameters: {'num_neuronios': 80, 'num_camadas': 4, 'funcao_de_ativacao': 'ELU', 'taxa_de_aprendizado': 0.03847157978282985, 'otimizador': 'ADAM'}. Best is trial 84 with value: 0.7725181894480123.
GPU available: True (cuda), used: True
TPU available: False, using: 0 TPU cores
IPU available: False, using: 0 IPUs
HPU available: False, using: 0 HPUs
LOCAL_RANK: 0 - CUDA_VISIBLE_DEVICES: [0]

  | Name          | Type       | Params
---------------------------------------------
0 | todas_camadas | Sequential | 36.1 K
---------------------------------------------
36.1 K    Trainable params
0         Non-trainable params
36.1 K    Total params
0.144     Total estimated model params size (MB)
SLURM auto-requeueing enabled. Setting signal handlers.
/home/geovana23021/anaconda3/envs/ilumpy/lib/python3.11/site-packages/lightning/pytorch/loops/fit_loop.py:298: The number of training batches (13) is smaller than the logging interval Trainer(log_every_n_steps=50). Set a lower value for log_every_n_steps if you want to see logs for the training epoch.
`Trainer.fit` stopped: `max_epochs=55` reached.
/home/geovana23021/anaconda3/envs/ilumpy/lib/python3.11/site-packages/sklearn/metrics/_regression.py:483: FutureWarning: 'squared' is deprecated in version 1.4 and will be removed in 1.6. To calculate the root mean squared error, use the function'root_mean_squared_error'.
  warnings.warn(
[I 2024-05-20 20:17:21,751] Trial 108 finished with value: 0.8357533440926502 and parameters: {'num_neuronios': 98, 'num_camadas': 4, 'funcao_de_ativacao': 'ELU', 'taxa_de_aprendizado': 0.007675162282618954, 'otimizador': 'ADAM'}. Best is trial 84 with value: 0.7725181894480123.
GPU available: True (cuda), used: True
TPU available: False, using: 0 TPU cores
IPU available: False, using: 0 IPUs
HPU available: False, using: 0 HPUs
LOCAL_RANK: 0 - CUDA_VISIBLE_DEVICES: [0]

  | Name          | Type       | Params
---------------------------------------------
0 | todas_camadas | Sequential | 32.2 K
---------------------------------------------
32.2 K    Trainable params
0         Non-trainable params
32.2 K    Total params
0.129     Total estimated model params size (MB)
SLURM auto-requeueing enabled. Setting signal handlers.
/home/geovana23021/anaconda3/envs/ilumpy/lib/python3.11/site-packages/lightning/pytorch/loops/fit_loop.py:298: The number of training batches (13) is smaller than the logging interval Trainer(log_every_n_steps=50). Set a lower value for log_every_n_steps if you want to see logs for the training epoch.
`Trainer.fit` stopped: `max_epochs=55` reached.
/home/geovana23021/anaconda3/envs/ilumpy/lib/python3.11/site-packages/sklearn/metrics/_regression.py:483: FutureWarning: 'squared' is deprecated in version 1.4 and will be removed in 1.6. To calculate the root mean squared error, use the function'root_mean_squared_error'.
  warnings.warn(
[I 2024-05-20 20:17:37,937] Trial 109 finished with value: 0.8634615888236077 and parameters: {'num_neuronios': 92, 'num_camadas': 4, 'funcao_de_ativacao': 'ELU', 'taxa_de_aprendizado': 0.007868699176981032, 'otimizador': 'ADAM'}. Best is trial 84 with value: 0.7725181894480123.
