[I 2024-05-20 19:49:24,870] Trial 13 finished with value: 4.131332443296141 and parameters: {'num_neuronios': 319, 'num_camadas': 4, 'funcao_de_ativacao': 'Tangente_Hiperbólica', 'taxa_de_aprendizado': 0.003775705435896304, 'otimizador': 'RMSPROP'}. Best is trial 11 with value: 0.8623690522435966.
GPU available: True (cuda), used: True
TPU available: False, using: 0 TPU cores
IPU available: False, using: 0 IPUs
HPU available: False, using: 0 HPUs
LOCAL_RANK: 0 - CUDA_VISIBLE_DEVICES: [0]

  | Name          | Type       | Params
---------------------------------------------
0 | todas_camadas | Sequential | 651 K 
---------------------------------------------
651 K     Trainable params
0         Non-trainable params
651 K     Total params
2.608     Total estimated model params size (MB)
SLURM auto-requeueing enabled. Setting signal handlers.
/home/geovana23021/anaconda3/envs/ilumpy/lib/python3.11/site-packages/lightning/pytorch/loops/fit_loop.py:298: The number of training batches (13) is smaller than the logging interval Trainer(log_every_n_steps=50). Set a lower value for log_every_n_steps if you want to see logs for the training epoch.
`Trainer.fit` stopped: `max_epochs=55` reached.
/home/geovana23021/anaconda3/envs/ilumpy/lib/python3.11/site-packages/sklearn/metrics/_regression.py:483: FutureWarning: 'squared' is deprecated in version 1.4 and will be removed in 1.6. To calculate the root mean squared error, use the function'root_mean_squared_error'.
  warnings.warn(
[I 2024-05-20 19:49:45,508] Trial 14 finished with value: 1.0194199395385664 and parameters: {'num_neuronios': 454, 'num_camadas': 4, 'funcao_de_ativacao': 'LeakyReLU', 'taxa_de_aprendizado': 0.0030145521214149833, 'otimizador': 'RMSPROP'}. Best is trial 11 with value: 0.8623690522435966.
GPU available: True (cuda), used: True
TPU available: False, using: 0 TPU cores
IPU available: False, using: 0 IPUs
HPU available: False, using: 0 HPUs
LOCAL_RANK: 0 - CUDA_VISIBLE_DEVICES: [0]

  | Name          | Type       | Params
---------------------------------------------
0 | todas_camadas | Sequential | 346 K 
---------------------------------------------
346 K     Trainable params
0         Non-trainable params
346 K     Total params
1.385     Total estimated model params size (MB)
SLURM auto-requeueing enabled. Setting signal handlers.
/home/geovana23021/anaconda3/envs/ilumpy/lib/python3.11/site-packages/lightning/pytorch/loops/fit_loop.py:298: The number of training batches (13) is smaller than the logging interval Trainer(log_every_n_steps=50). Set a lower value for log_every_n_steps if you want to see logs for the training epoch.
`Trainer.fit` stopped: `max_epochs=55` reached.
/home/geovana23021/anaconda3/envs/ilumpy/lib/python3.11/site-packages/sklearn/metrics/_regression.py:483: FutureWarning: 'squared' is deprecated in version 1.4 and will be removed in 1.6. To calculate the root mean squared error, use the function'root_mean_squared_error'.
  warnings.warn(
[I 2024-05-20 19:50:05,623] Trial 15 finished with value: 0.8856403519241286 and parameters: {'num_neuronios': 285, 'num_camadas': 5, 'funcao_de_ativacao': 'ELU', 'taxa_de_aprendizado': 0.000112243784803481, 'otimizador': 'ADAM'}. Best is trial 11 with value: 0.8623690522435966.
GPU available: True (cuda), used: True
TPU available: False, using: 0 TPU cores
IPU available: False, using: 0 IPUs
HPU available: False, using: 0 HPUs
LOCAL_RANK: 0 - CUDA_VISIBLE_DEVICES: [0]

  | Name          | Type       | Params
---------------------------------------------
0 | todas_camadas | Sequential | 112 K 
---------------------------------------------
112 K     Trainable params
0         Non-trainable params
112 K     Total params
0.451     Total estimated model params size (MB)
SLURM auto-requeueing enabled. Setting signal handlers.
/home/geovana23021/anaconda3/envs/ilumpy/lib/python3.11/site-packages/lightning/pytorch/loops/fit_loop.py:298: The number of training batches (13) is smaller than the logging interval Trainer(log_every_n_steps=50). Set a lower value for log_every_n_steps if you want to see logs for the training epoch.
`Trainer.fit` stopped: `max_epochs=55` reached.
/home/geovana23021/anaconda3/envs/ilumpy/lib/python3.11/site-packages/sklearn/metrics/_regression.py:483: FutureWarning: 'squared' is deprecated in version 1.4 and will be removed in 1.6. To calculate the root mean squared error, use the function'root_mean_squared_error'.
  warnings.warn(
[I 2024-05-20 19:50:23,037] Trial 16 finished with value: 0.8890158999048091 and parameters: {'num_neuronios': 182, 'num_camadas': 4, 'funcao_de_ativacao': 'ELU', 'taxa_de_aprendizado': 7.471580698495465e-05, 'otimizador': 'RMSPROP'}. Best is trial 11 with value: 0.8623690522435966.
GPU available: True (cuda), used: True
TPU available: False, using: 0 TPU cores
IPU available: False, using: 0 IPUs
HPU available: False, using: 0 HPUs
LOCAL_RANK: 0 - CUDA_VISIBLE_DEVICES: [0]

  | Name          | Type       | Params
---------------------------------------------
0 | todas_camadas | Sequential | 578 K 
---------------------------------------------
578 K     Trainable params
0         Non-trainable params
578 K     Total params
2.314     Total estimated model params size (MB)
SLURM auto-requeueing enabled. Setting signal handlers.
/home/geovana23021/anaconda3/envs/ilumpy/lib/python3.11/site-packages/lightning/pytorch/loops/fit_loop.py:298: The number of training batches (13) is smaller than the logging interval Trainer(log_every_n_steps=50). Set a lower value for log_every_n_steps if you want to see logs for the training epoch.
`Trainer.fit` stopped: `max_epochs=55` reached.
/home/geovana23021/anaconda3/envs/ilumpy/lib/python3.11/site-packages/sklearn/metrics/_regression.py:483: FutureWarning: 'squared' is deprecated in version 1.4 and will be removed in 1.6. To calculate the root mean squared error, use the function'root_mean_squared_error'.
  warnings.warn(
[I 2024-05-20 19:50:46,311] Trial 17 finished with value: 1.081867824967276 and parameters: {'num_neuronios': 371, 'num_camadas': 5, 'funcao_de_ativacao': 'ELU', 'taxa_de_aprendizado': 0.032115215959256004, 'otimizador': 'ADAM'}. Best is trial 11 with value: 0.8623690522435966.
GPU available: True (cuda), used: True
TPU available: False, using: 0 TPU cores
IPU available: False, using: 0 IPUs
HPU available: False, using: 0 HPUs
LOCAL_RANK: 0 - CUDA_VISIBLE_DEVICES: [0]

  | Name          | Type       | Params
---------------------------------------------
0 | todas_camadas | Sequential | 732 K 
---------------------------------------------
732 K     Trainable params
0         Non-trainable params
732 K     Total params
2.931     Total estimated model params size (MB)
SLURM auto-requeueing enabled. Setting signal handlers.
/home/geovana23021/anaconda3/envs/ilumpy/lib/python3.11/site-packages/lightning/pytorch/loops/fit_loop.py:298: The number of training batches (13) is smaller than the logging interval Trainer(log_every_n_steps=50). Set a lower value for log_every_n_steps if you want to see logs for the training epoch.
`Trainer.fit` stopped: `max_epochs=55` reached.
/home/geovana23021/anaconda3/envs/ilumpy/lib/python3.11/site-packages/sklearn/metrics/_regression.py:483: FutureWarning: 'squared' is deprecated in version 1.4 and will be removed in 1.6. To calculate the root mean squared error, use the function'root_mean_squared_error'.
  warnings.warn(
[I 2024-05-20 19:51:11,412] Trial 18 finished with value: 0.865401161500013 and parameters: {'num_neuronios': 482, 'num_camadas': 4, 'funcao_de_ativacao': 'Relu', 'taxa_de_aprendizado': 8.976958165687298e-05, 'otimizador': 'ADAM'}. Best is trial 11 with value: 0.8623690522435966.
GPU available: True (cuda), used: True
TPU available: False, using: 0 TPU cores
IPU available: False, using: 0 IPUs
HPU available: False, using: 0 HPUs
LOCAL_RANK: 0 - CUDA_VISIBLE_DEVICES: [0]

  | Name          | Type       | Params
---------------------------------------------
0 | todas_camadas | Sequential | 691 K 
---------------------------------------------
691 K     Trainable params
0         Non-trainable params
691 K     Total params
2.767     Total estimated model params size (MB)
SLURM auto-requeueing enabled. Setting signal handlers.
/home/geovana23021/anaconda3/envs/ilumpy/lib/python3.11/site-packages/lightning/pytorch/loops/fit_loop.py:298: The number of training batches (13) is smaller than the logging interval Trainer(log_every_n_steps=50). Set a lower value for log_every_n_steps if you want to see logs for the training epoch.
`Trainer.fit` stopped: `max_epochs=55` reached.
/home/geovana23021/anaconda3/envs/ilumpy/lib/python3.11/site-packages/sklearn/metrics/_regression.py:483: FutureWarning: 'squared' is deprecated in version 1.4 and will be removed in 1.6. To calculate the root mean squared error, use the function'root_mean_squared_error'.
  warnings.warn(
[I 2024-05-20 19:51:32,473] Trial 19 finished with value: 1.2981767387685297 and parameters: {'num_neuronios': 468, 'num_camadas': 4, 'funcao_de_ativacao': 'Relu', 'taxa_de_aprendizado': 0.04780034231706224, 'otimizador': 'RMSPROP'}. Best is trial 11 with value: 0.8623690522435966.
GPU available: True (cuda), used: True
TPU available: False, using: 0 TPU cores
IPU available: False, using: 0 IPUs
HPU available: False, using: 0 HPUs
LOCAL_RANK: 0 - CUDA_VISIBLE_DEVICES: [0]

  | Name          | Type       | Params
---------------------------------------------
0 | todas_camadas | Sequential | 833 K 
---------------------------------------------
833 K     Trainable params
0         Non-trainable params
833 K     Total params
3.335     Total estimated model params size (MB)
SLURM auto-requeueing enabled. Setting signal handlers.
/home/geovana23021/anaconda3/envs/ilumpy/lib/python3.11/site-packages/lightning/pytorch/loops/fit_loop.py:298: The number of training batches (13) is smaller than the logging interval Trainer(log_every_n_steps=50). Set a lower value for log_every_n_steps if you want to see logs for the training epoch.
`Trainer.fit` stopped: `max_epochs=55` reached.
/home/geovana23021/anaconda3/envs/ilumpy/lib/python3.11/site-packages/sklearn/metrics/_regression.py:483: FutureWarning: 'squared' is deprecated in version 1.4 and will be removed in 1.6. To calculate the root mean squared error, use the function'root_mean_squared_error'.
  warnings.warn(
[I 2024-05-20 19:51:54,610] Trial 20 finished with value: 0.9124068169293619 and parameters: {'num_neuronios': 515, 'num_camadas': 4, 'funcao_de_ativacao': 'Relu', 'taxa_de_aprendizado': 6.039201558325655e-05, 'otimizador': 'RMSPROP'}. Best is trial 11 with value: 0.8623690522435966.
GPU available: True (cuda), used: True
TPU available: False, using: 0 TPU cores
IPU available: False, using: 0 IPUs
HPU available: False, using: 0 HPUs
LOCAL_RANK: 0 - CUDA_VISIBLE_DEVICES: [0]

  | Name          | Type       | Params
---------------------------------------------
0 | todas_camadas | Sequential | 454 K 
---------------------------------------------
454 K     Trainable params
0         Non-trainable params
454 K     Total params
1.817     Total estimated model params size (MB)
SLURM auto-requeueing enabled. Setting signal handlers.
/home/geovana23021/anaconda3/envs/ilumpy/lib/python3.11/site-packages/lightning/pytorch/loops/fit_loop.py:298: The number of training batches (13) is smaller than the logging interval Trainer(log_every_n_steps=50). Set a lower value for log_every_n_steps if you want to see logs for the training epoch.
`Trainer.fit` stopped: `max_epochs=55` reached.
/home/geovana23021/anaconda3/envs/ilumpy/lib/python3.11/site-packages/sklearn/metrics/_regression.py:483: FutureWarning: 'squared' is deprecated in version 1.4 and will be removed in 1.6. To calculate the root mean squared error, use the function'root_mean_squared_error'.
  warnings.warn(
[I 2024-05-20 19:52:15,623] Trial 21 finished with value: 0.8862410830147528 and parameters: {'num_neuronios': 377, 'num_camadas': 4, 'funcao_de_ativacao': 'Relu', 'taxa_de_aprendizado': 0.0001952130339651507, 'otimizador': 'ADAM'}. Best is trial 11 with value: 0.8623690522435966.
GPU available: True (cuda), used: True
TPU available: False, using: 0 TPU cores
IPU available: False, using: 0 IPUs
HPU available: False, using: 0 HPUs
LOCAL_RANK: 0 - CUDA_VISIBLE_DEVICES: [0]

  | Name          | Type       | Params
---------------------------------------------
0 | todas_camadas | Sequential | 201 K 
---------------------------------------------
201 K     Trainable params
0         Non-trainable params
201 K     Total params
0.805     Total estimated model params size (MB)
SLURM auto-requeueing enabled. Setting signal handlers.
/home/geovana23021/anaconda3/envs/ilumpy/lib/python3.11/site-packages/lightning/pytorch/loops/fit_loop.py:298: The number of training batches (13) is smaller than the logging interval Trainer(log_every_n_steps=50). Set a lower value for log_every_n_steps if you want to see logs for the training epoch.
`Trainer.fit` stopped: `max_epochs=55` reached.
/home/geovana23021/anaconda3/envs/ilumpy/lib/python3.11/site-packages/sklearn/metrics/_regression.py:483: FutureWarning: 'squared' is deprecated in version 1.4 and will be removed in 1.6. To calculate the root mean squared error, use the function'root_mean_squared_error'.
  warnings.warn(
[I 2024-05-20 19:52:34,517] Trial 22 finished with value: 0.8523559643214617 and parameters: {'num_neuronios': 247, 'num_camadas': 4, 'funcao_de_ativacao': 'Sigmoide', 'taxa_de_aprendizado': 0.0013650690893187215, 'otimizador': 'ADAM'}. Best is trial 22 with value: 0.8523559643214617.
GPU available: True (cuda), used: True
TPU available: False, using: 0 TPU cores
IPU available: False, using: 0 IPUs
HPU available: False, using: 0 HPUs
LOCAL_RANK: 0 - CUDA_VISIBLE_DEVICES: [0]

  | Name          | Type       | Params
---------------------------------------------
0 | todas_camadas | Sequential | 193 K 
---------------------------------------------
193 K     Trainable params
0         Non-trainable params
193 K     Total params
0.774     Total estimated model params size (MB)
SLURM auto-requeueing enabled. Setting signal handlers.
/home/geovana23021/anaconda3/envs/ilumpy/lib/python3.11/site-packages/lightning/pytorch/loops/fit_loop.py:298: The number of training batches (13) is smaller than the logging interval Trainer(log_every_n_steps=50). Set a lower value for log_every_n_steps if you want to see logs for the training epoch.
`Trainer.fit` stopped: `max_epochs=55` reached.
/home/geovana23021/anaconda3/envs/ilumpy/lib/python3.11/site-packages/sklearn/metrics/_regression.py:483: FutureWarning: 'squared' is deprecated in version 1.4 and will be removed in 1.6. To calculate the root mean squared error, use the function'root_mean_squared_error'.
  warnings.warn(
[I 2024-05-20 19:52:53,318] Trial 23 finished with value: 0.8486840242337377 and parameters: {'num_neuronios': 242, 'num_camadas': 4, 'funcao_de_ativacao': 'Sigmoide', 'taxa_de_aprendizado': 0.0012829857819477714, 'otimizador': 'ADAM'}. Best is trial 23 with value: 0.8486840242337377.
GPU available: True (cuda), used: True
TPU available: False, using: 0 TPU cores
IPU available: False, using: 0 IPUs
HPU available: False, using: 0 HPUs
LOCAL_RANK: 0 - CUDA_VISIBLE_DEVICES: [0]

  | Name          | Type       | Params
---------------------------------------------
0 | todas_camadas | Sequential | 183 K 
---------------------------------------------
183 K     Trainable params
0         Non-trainable params
183 K     Total params
0.732     Total estimated model params size (MB)
SLURM auto-requeueing enabled. Setting signal handlers.
/home/geovana23021/anaconda3/envs/ilumpy/lib/python3.11/site-packages/lightning/pytorch/loops/fit_loop.py:298: The number of training batches (13) is smaller than the logging interval Trainer(log_every_n_steps=50). Set a lower value for log_every_n_steps if you want to see logs for the training epoch.
`Trainer.fit` stopped: `max_epochs=55` reached.
/home/geovana23021/anaconda3/envs/ilumpy/lib/python3.11/site-packages/sklearn/metrics/_regression.py:483: FutureWarning: 'squared' is deprecated in version 1.4 and will be removed in 1.6. To calculate the root mean squared error, use the function'root_mean_squared_error'.
  warnings.warn(
[I 2024-05-20 19:53:12,098] Trial 24 finished with value: 0.8461451605766874 and parameters: {'num_neuronios': 235, 'num_camadas': 4, 'funcao_de_ativacao': 'Sigmoide', 'taxa_de_aprendizado': 0.0019288320863842954, 'otimizador': 'ADAM'}. Best is trial 24 with value: 0.8461451605766874.
GPU available: True (cuda), used: True
TPU available: False, using: 0 TPU cores
IPU available: False, using: 0 IPUs
HPU available: False, using: 0 HPUs
LOCAL_RANK: 0 - CUDA_VISIBLE_DEVICES: [0]

  | Name          | Type       | Params
---------------------------------------------
0 | todas_camadas | Sequential | 66.5 K
---------------------------------------------
66.5 K    Trainable params
0         Non-trainable params
66.5 K    Total params
0.266     Total estimated model params size (MB)
SLURM auto-requeueing enabled. Setting signal handlers.
/home/geovana23021/anaconda3/envs/ilumpy/lib/python3.11/site-packages/lightning/pytorch/loops/fit_loop.py:298: The number of training batches (13) is smaller than the logging interval Trainer(log_every_n_steps=50). Set a lower value for log_every_n_steps if you want to see logs for the training epoch.
`Trainer.fit` stopped: `max_epochs=55` reached.
/home/geovana23021/anaconda3/envs/ilumpy/lib/python3.11/site-packages/sklearn/metrics/_regression.py:483: FutureWarning: 'squared' is deprecated in version 1.4 and will be removed in 1.6. To calculate the root mean squared error, use the function'root_mean_squared_error'.
  warnings.warn(
[I 2024-05-20 19:53:30,538] Trial 25 finished with value: 0.898657279802393 and parameters: {'num_neuronios': 165, 'num_camadas': 3, 'funcao_de_ativacao': 'Sigmoide', 'taxa_de_aprendizado': 0.0014931285462273902, 'otimizador': 'ADAM'}. Best is trial 24 with value: 0.8461451605766874.
GPU available: True (cuda), used: True
TPU available: False, using: 0 TPU cores
IPU available: False, using: 0 IPUs
HPU available: False, using: 0 HPUs
LOCAL_RANK: 0 - CUDA_VISIBLE_DEVICES: [0]

  | Name          | Type       | Params
---------------------------------------------
0 | todas_camadas | Sequential | 193 K 
---------------------------------------------
193 K     Trainable params
0         Non-trainable params
193 K     Total params
0.774     Total estimated model params size (MB)
SLURM auto-requeueing enabled. Setting signal handlers.
/home/geovana23021/anaconda3/envs/ilumpy/lib/python3.11/site-packages/lightning/pytorch/loops/fit_loop.py:298: The number of training batches (13) is smaller than the logging interval Trainer(log_every_n_steps=50). Set a lower value for log_every_n_steps if you want to see logs for the training epoch.
`Trainer.fit` stopped: `max_epochs=55` reached.
/home/geovana23021/anaconda3/envs/ilumpy/lib/python3.11/site-packages/sklearn/metrics/_regression.py:483: FutureWarning: 'squared' is deprecated in version 1.4 and will be removed in 1.6. To calculate the root mean squared error, use the function'root_mean_squared_error'.
  warnings.warn(
[I 2024-05-20 19:53:49,237] Trial 26 finished with value: 1.0504419714034108 and parameters: {'num_neuronios': 242, 'num_camadas': 4, 'funcao_de_ativacao': 'Sigmoide', 'taxa_de_aprendizado': 0.0129454931215542, 'otimizador': 'ADAM'}. Best is trial 24 with value: 0.8461451605766874.
GPU available: True (cuda), used: True
TPU available: False, using: 0 TPU cores
IPU available: False, using: 0 IPUs
HPU available: False, using: 0 HPUs
LOCAL_RANK: 0 - CUDA_VISIBLE_DEVICES: [0]

  | Name          | Type       | Params
---------------------------------------------
0 | todas_camadas | Sequential | 68.2 K
---------------------------------------------
68.2 K    Trainable params
0         Non-trainable params
68.2 K    Total params
0.273     Total estimated model params size (MB)
SLURM auto-requeueing enabled. Setting signal handlers.
/home/geovana23021/anaconda3/envs/ilumpy/lib/python3.11/site-packages/lightning/pytorch/loops/fit_loop.py:298: The number of training batches (13) is smaller than the logging interval Trainer(log_every_n_steps=50). Set a lower value for log_every_n_steps if you want to see logs for the training epoch.
`Trainer.fit` stopped: `max_epochs=55` reached.
/home/geovana23021/anaconda3/envs/ilumpy/lib/python3.11/site-packages/sklearn/metrics/_regression.py:483: FutureWarning: 'squared' is deprecated in version 1.4 and will be removed in 1.6. To calculate the root mean squared error, use the function'root_mean_squared_error'.
  warnings.warn(
