[I 2024-05-20 19:54:06,746] Trial 27 finished with value: 0.8532153241289367 and parameters: {'num_neuronios': 139, 'num_camadas': 4, 'funcao_de_ativacao': 'Sigmoide', 'taxa_de_aprendizado': 0.0016142258703355544, 'otimizador': 'ADAM'}. Best is trial 24 with value: 0.8461451605766874.
GPU available: True (cuda), used: True
TPU available: False, using: 0 TPU cores
IPU available: False, using: 0 IPUs
HPU available: False, using: 0 HPUs
LOCAL_RANK: 0 - CUDA_VISIBLE_DEVICES: [0]

  | Name          | Type       | Params
---------------------------------------------
0 | todas_camadas | Sequential | 122 K 
---------------------------------------------
122 K     Trainable params
0         Non-trainable params
122 K     Total params
0.490     Total estimated model params size (MB)
SLURM auto-requeueing enabled. Setting signal handlers.
/home/geovana23021/anaconda3/envs/ilumpy/lib/python3.11/site-packages/lightning/pytorch/loops/fit_loop.py:298: The number of training batches (13) is smaller than the logging interval Trainer(log_every_n_steps=50). Set a lower value for log_every_n_steps if you want to see logs for the training epoch.
`Trainer.fit` stopped: `max_epochs=55` reached.
/home/geovana23021/anaconda3/envs/ilumpy/lib/python3.11/site-packages/sklearn/metrics/_regression.py:483: FutureWarning: 'squared' is deprecated in version 1.4 and will be removed in 1.6. To calculate the root mean squared error, use the function'root_mean_squared_error'.
  warnings.warn(
[I 2024-05-20 19:54:24,435] Trial 28 finished with value: 0.908669885316648 and parameters: {'num_neuronios': 230, 'num_camadas': 3, 'funcao_de_ativacao': 'Sigmoide', 'taxa_de_aprendizado': 0.0008262542736190939, 'otimizador': 'ADAM'}. Best is trial 24 with value: 0.8461451605766874.
GPU available: True (cuda), used: True
TPU available: False, using: 0 TPU cores
IPU available: False, using: 0 IPUs
HPU available: False, using: 0 HPUs
LOCAL_RANK: 0 - CUDA_VISIBLE_DEVICES: [0]

  | Name          | Type       | Params
---------------------------------------------
0 | todas_camadas | Sequential | 230 K 
---------------------------------------------
230 K     Trainable params
0         Non-trainable params
230 K     Total params
0.923     Total estimated model params size (MB)
SLURM auto-requeueing enabled. Setting signal handlers.
/home/geovana23021/anaconda3/envs/ilumpy/lib/python3.11/site-packages/lightning/pytorch/loops/fit_loop.py:298: The number of training batches (13) is smaller than the logging interval Trainer(log_every_n_steps=50). Set a lower value for log_every_n_steps if you want to see logs for the training epoch.
`Trainer.fit` stopped: `max_epochs=55` reached.
/home/geovana23021/anaconda3/envs/ilumpy/lib/python3.11/site-packages/sklearn/metrics/_regression.py:483: FutureWarning: 'squared' is deprecated in version 1.4 and will be removed in 1.6. To calculate the root mean squared error, use the function'root_mean_squared_error'.
  warnings.warn(
[I 2024-05-20 19:54:44,324] Trial 29 finished with value: 1.0355281012953994 and parameters: {'num_neuronios': 322, 'num_camadas': 3, 'funcao_de_ativacao': 'Sigmoide', 'taxa_de_aprendizado': 0.08954599121812534, 'otimizador': 'ADAM'}. Best is trial 24 with value: 0.8461451605766874.
GPU available: True (cuda), used: True
TPU available: False, using: 0 TPU cores
IPU available: False, using: 0 IPUs
HPU available: False, using: 0 HPUs
LOCAL_RANK: 0 - CUDA_VISIBLE_DEVICES: [0]

  | Name          | Type       | Params
---------------------------------------------
0 | todas_camadas | Sequential | 264 K 
---------------------------------------------
264 K     Trainable params
0         Non-trainable params
264 K     Total params
1.059     Total estimated model params size (MB)
SLURM auto-requeueing enabled. Setting signal handlers.
/home/geovana23021/anaconda3/envs/ilumpy/lib/python3.11/site-packages/lightning/pytorch/loops/fit_loop.py:298: The number of training batches (13) is smaller than the logging interval Trainer(log_every_n_steps=50). Set a lower value for log_every_n_steps if you want to see logs for the training epoch.
`Trainer.fit` stopped: `max_epochs=55` reached.
/home/geovana23021/anaconda3/envs/ilumpy/lib/python3.11/site-packages/sklearn/metrics/_regression.py:483: FutureWarning: 'squared' is deprecated in version 1.4 and will be removed in 1.6. To calculate the root mean squared error, use the function'root_mean_squared_error'.
  warnings.warn(
[I 2024-05-20 19:55:03,598] Trial 30 finished with value: 1.0605457961261788 and parameters: {'num_neuronios': 285, 'num_camadas': 4, 'funcao_de_ativacao': 'Sigmoide', 'taxa_de_aprendizado': 0.010074622946802498, 'otimizador': 'ADAM'}. Best is trial 24 with value: 0.8461451605766874.
GPU available: True (cuda), used: True
TPU available: False, using: 0 TPU cores
IPU available: False, using: 0 IPUs
HPU available: False, using: 0 HPUs
LOCAL_RANK: 0 - CUDA_VISIBLE_DEVICES: [0]

  | Name          | Type       | Params
---------------------------------------------
0 | todas_camadas | Sequential | 71.9 K
---------------------------------------------
71.9 K    Trainable params
0         Non-trainable params
71.9 K    Total params
0.288     Total estimated model params size (MB)
SLURM auto-requeueing enabled. Setting signal handlers.
/home/geovana23021/anaconda3/envs/ilumpy/lib/python3.11/site-packages/lightning/pytorch/loops/fit_loop.py:298: The number of training batches (13) is smaller than the logging interval Trainer(log_every_n_steps=50). Set a lower value for log_every_n_steps if you want to see logs for the training epoch.
`Trainer.fit` stopped: `max_epochs=55` reached.
/home/geovana23021/anaconda3/envs/ilumpy/lib/python3.11/site-packages/sklearn/metrics/_regression.py:483: FutureWarning: 'squared' is deprecated in version 1.4 and will be removed in 1.6. To calculate the root mean squared error, use the function'root_mean_squared_error'.
  warnings.warn(
[I 2024-05-20 19:55:20,782] Trial 31 finished with value: 0.8494249662590841 and parameters: {'num_neuronios': 143, 'num_camadas': 4, 'funcao_de_ativacao': 'Sigmoide', 'taxa_de_aprendizado': 0.0019087686805679186, 'otimizador': 'ADAM'}. Best is trial 24 with value: 0.8461451605766874.
GPU available: True (cuda), used: True
TPU available: False, using: 0 TPU cores
IPU available: False, using: 0 IPUs
HPU available: False, using: 0 HPUs
LOCAL_RANK: 0 - CUDA_VISIBLE_DEVICES: [0]

  | Name          | Type       | Params
---------------------------------------------
0 | todas_camadas | Sequential | 61.2 K
---------------------------------------------
61.2 K    Trainable params
0         Non-trainable params
61.2 K    Total params
0.245     Total estimated model params size (MB)
SLURM auto-requeueing enabled. Setting signal handlers.
/home/geovana23021/anaconda3/envs/ilumpy/lib/python3.11/site-packages/lightning/pytorch/loops/fit_loop.py:298: The number of training batches (13) is smaller than the logging interval Trainer(log_every_n_steps=50). Set a lower value for log_every_n_steps if you want to see logs for the training epoch.
`Trainer.fit` stopped: `max_epochs=55` reached.
/home/geovana23021/anaconda3/envs/ilumpy/lib/python3.11/site-packages/sklearn/metrics/_regression.py:483: FutureWarning: 'squared' is deprecated in version 1.4 and will be removed in 1.6. To calculate the root mean squared error, use the function'root_mean_squared_error'.
  warnings.warn(
[I 2024-05-20 19:55:37,611] Trial 32 finished with value: 0.8533056413177533 and parameters: {'num_neuronios': 131, 'num_camadas': 4, 'funcao_de_ativacao': 'Sigmoide', 'taxa_de_aprendizado': 0.0037709727045836363, 'otimizador': 'ADAM'}. Best is trial 24 with value: 0.8461451605766874.
GPU available: True (cuda), used: True
TPU available: False, using: 0 TPU cores
IPU available: False, using: 0 IPUs
HPU available: False, using: 0 HPUs
LOCAL_RANK: 0 - CUDA_VISIBLE_DEVICES: [0]

  | Name          | Type       | Params
---------------------------------------------
0 | todas_camadas | Sequential | 141 K 
---------------------------------------------
141 K     Trainable params
0         Non-trainable params
141 K     Total params
0.565     Total estimated model params size (MB)
SLURM auto-requeueing enabled. Setting signal handlers.
/home/geovana23021/anaconda3/envs/ilumpy/lib/python3.11/site-packages/lightning/pytorch/loops/fit_loop.py:298: The number of training batches (13) is smaller than the logging interval Trainer(log_every_n_steps=50). Set a lower value for log_every_n_steps if you want to see logs for the training epoch.
`Trainer.fit` stopped: `max_epochs=55` reached.
/home/geovana23021/anaconda3/envs/ilumpy/lib/python3.11/site-packages/sklearn/metrics/_regression.py:483: FutureWarning: 'squared' is deprecated in version 1.4 and will be removed in 1.6. To calculate the root mean squared error, use the function'root_mean_squared_error'.
  warnings.warn(
[I 2024-05-20 19:55:55,759] Trial 33 finished with value: 0.8451216732380793 and parameters: {'num_neuronios': 205, 'num_camadas': 4, 'funcao_de_ativacao': 'Sigmoide', 'taxa_de_aprendizado': 0.0015945854798230308, 'otimizador': 'ADAM'}. Best is trial 33 with value: 0.8451216732380793.
GPU available: True (cuda), used: True
TPU available: False, using: 0 TPU cores
IPU available: False, using: 0 IPUs
HPU available: False, using: 0 HPUs
LOCAL_RANK: 0 - CUDA_VISIBLE_DEVICES: [0]

  | Name          | Type       | Params
---------------------------------------------
0 | todas_camadas | Sequential | 31.6 K
---------------------------------------------
31.6 K    Trainable params
0         Non-trainable params
31.6 K    Total params
0.126     Total estimated model params size (MB)
SLURM auto-requeueing enabled. Setting signal handlers.
/home/geovana23021/anaconda3/envs/ilumpy/lib/python3.11/site-packages/lightning/pytorch/loops/fit_loop.py:298: The number of training batches (13) is smaller than the logging interval Trainer(log_every_n_steps=50). Set a lower value for log_every_n_steps if you want to see logs for the training epoch.
`Trainer.fit` stopped: `max_epochs=55` reached.
/home/geovana23021/anaconda3/envs/ilumpy/lib/python3.11/site-packages/sklearn/metrics/_regression.py:483: FutureWarning: 'squared' is deprecated in version 1.4 and will be removed in 1.6. To calculate the root mean squared error, use the function'root_mean_squared_error'.
  warnings.warn(
[I 2024-05-20 19:56:11,710] Trial 34 finished with value: 0.9371770789480445 and parameters: {'num_neuronios': 91, 'num_camadas': 4, 'funcao_de_ativacao': 'LeakyReLU', 'taxa_de_aprendizado': 0.005782442695754017, 'otimizador': 'ADAM'}. Best is trial 33 with value: 0.8451216732380793.
GPU available: True (cuda), used: True
TPU available: False, using: 0 TPU cores
IPU available: False, using: 0 IPUs
HPU available: False, using: 0 HPUs
LOCAL_RANK: 0 - CUDA_VISIBLE_DEVICES: [0]

  | Name          | Type       | Params
---------------------------------------------
0 | todas_camadas | Sequential | 127 K 
---------------------------------------------
127 K     Trainable params
0         Non-trainable params
127 K     Total params
0.509     Total estimated model params size (MB)
SLURM auto-requeueing enabled. Setting signal handlers.
/home/geovana23021/anaconda3/envs/ilumpy/lib/python3.11/site-packages/lightning/pytorch/loops/fit_loop.py:298: The number of training batches (13) is smaller than the logging interval Trainer(log_every_n_steps=50). Set a lower value for log_every_n_steps if you want to see logs for the training epoch.
`Trainer.fit` stopped: `max_epochs=55` reached.
/home/geovana23021/anaconda3/envs/ilumpy/lib/python3.11/site-packages/sklearn/metrics/_regression.py:483: FutureWarning: 'squared' is deprecated in version 1.4 and will be removed in 1.6. To calculate the root mean squared error, use the function'root_mean_squared_error'.
  warnings.warn(
[I 2024-05-20 19:56:30,674] Trial 35 finished with value: 1.0354229168474036 and parameters: {'num_neuronios': 194, 'num_camadas': 4, 'funcao_de_ativacao': 'Sigmoide', 'taxa_de_aprendizado': 0.017398213792551184, 'otimizador': 'ADAM'}. Best is trial 33 with value: 0.8451216732380793.
GPU available: True (cuda), used: True
TPU available: False, using: 0 TPU cores
IPU available: False, using: 0 IPUs
HPU available: False, using: 0 HPUs
LOCAL_RANK: 0 - CUDA_VISIBLE_DEVICES: [0]

  | Name          | Type       | Params
---------------------------------------------
0 | todas_camadas | Sequential | 83.5 K
---------------------------------------------
83.5 K    Trainable params
0         Non-trainable params
83.5 K    Total params
0.334     Total estimated model params size (MB)
SLURM auto-requeueing enabled. Setting signal handlers.
/home/geovana23021/anaconda3/envs/ilumpy/lib/python3.11/site-packages/lightning/pytorch/loops/fit_loop.py:298: The number of training batches (13) is smaller than the logging interval Trainer(log_every_n_steps=50). Set a lower value for log_every_n_steps if you want to see logs for the training epoch.
`Trainer.fit` stopped: `max_epochs=55` reached.
/home/geovana23021/anaconda3/envs/ilumpy/lib/python3.11/site-packages/sklearn/metrics/_regression.py:483: FutureWarning: 'squared' is deprecated in version 1.4 and will be removed in 1.6. To calculate the root mean squared error, use the function'root_mean_squared_error'.
  warnings.warn(
[I 2024-05-20 19:56:48,114] Trial 36 finished with value: 0.9348692536472174 and parameters: {'num_neuronios': 155, 'num_camadas': 4, 'funcao_de_ativacao': 'Sigmoide', 'taxa_de_aprendizado': 0.0003979116258183906, 'otimizador': 'ADAM'}. Best is trial 33 with value: 0.8451216732380793.
GPU available: True (cuda), used: True
TPU available: False, using: 0 TPU cores
IPU available: False, using: 0 IPUs
HPU available: False, using: 0 HPUs
LOCAL_RANK: 0 - CUDA_VISIBLE_DEVICES: [0]

  | Name          | Type       | Params
---------------------------------------------
0 | todas_camadas | Sequential | 104 K 
---------------------------------------------
104 K     Trainable params
0         Non-trainable params
104 K     Total params
0.418     Total estimated model params size (MB)
SLURM auto-requeueing enabled. Setting signal handlers.
/home/geovana23021/anaconda3/envs/ilumpy/lib/python3.11/site-packages/lightning/pytorch/loops/fit_loop.py:298: The number of training batches (13) is smaller than the logging interval Trainer(log_every_n_steps=50). Set a lower value for log_every_n_steps if you want to see logs for the training epoch.
`Trainer.fit` stopped: `max_epochs=55` reached.
/home/geovana23021/anaconda3/envs/ilumpy/lib/python3.11/site-packages/sklearn/metrics/_regression.py:483: FutureWarning: 'squared' is deprecated in version 1.4 and will be removed in 1.6. To calculate the root mean squared error, use the function'root_mean_squared_error'.
  warnings.warn(
[I 2024-05-20 19:57:05,286] Trial 37 finished with value: 0.8944668618285943 and parameters: {'num_neuronios': 211, 'num_camadas': 3, 'funcao_de_ativacao': 'Sigmoide', 'taxa_de_aprendizado': 0.000924434113969565, 'otimizador': 'ADAM'}. Best is trial 33 with value: 0.8451216732380793.
GPU available: True (cuda), used: True
TPU available: False, using: 0 TPU cores
IPU available: False, using: 0 IPUs
HPU available: False, using: 0 HPUs
LOCAL_RANK: 0 - CUDA_VISIBLE_DEVICES: [0]

  | Name          | Type       | Params
---------------------------------------------
0 | todas_camadas | Sequential | 13.1 K
---------------------------------------------
13.1 K    Trainable params
0         Non-trainable params
13.1 K    Total params
0.053     Total estimated model params size (MB)
SLURM auto-requeueing enabled. Setting signal handlers.
/home/geovana23021/anaconda3/envs/ilumpy/lib/python3.11/site-packages/lightning/pytorch/loops/fit_loop.py:298: The number of training batches (13) is smaller than the logging interval Trainer(log_every_n_steps=50). Set a lower value for log_every_n_steps if you want to see logs for the training epoch.
`Trainer.fit` stopped: `max_epochs=55` reached.
/home/geovana23021/anaconda3/envs/ilumpy/lib/python3.11/site-packages/sklearn/metrics/_regression.py:483: FutureWarning: 'squared' is deprecated in version 1.4 and will be removed in 1.6. To calculate the root mean squared error, use the function'root_mean_squared_error'.
  warnings.warn(
[I 2024-05-20 19:57:20,937] Trial 38 finished with value: 0.8901665683406926 and parameters: {'num_neuronios': 55, 'num_camadas': 4, 'funcao_de_ativacao': 'Tangente_Hiperbólica', 'taxa_de_aprendizado': 0.002313402828872736, 'otimizador': 'ADAM'}. Best is trial 33 with value: 0.8451216732380793.
GPU available: True (cuda), used: True
TPU available: False, using: 0 TPU cores
IPU available: False, using: 0 IPUs
HPU available: False, using: 0 HPUs
LOCAL_RANK: 0 - CUDA_VISIBLE_DEVICES: [0]

  | Name          | Type       | Params
---------------------------------------------
0 | todas_camadas | Sequential | 42.3 K
---------------------------------------------
42.3 K    Trainable params
0         Non-trainable params
42.3 K    Total params
0.169     Total estimated model params size (MB)
SLURM auto-requeueing enabled. Setting signal handlers.
/home/geovana23021/anaconda3/envs/ilumpy/lib/python3.11/site-packages/lightning/pytorch/loops/fit_loop.py:298: The number of training batches (13) is smaller than the logging interval Trainer(log_every_n_steps=50). Set a lower value for log_every_n_steps if you want to see logs for the training epoch.
`Trainer.fit` stopped: `max_epochs=55` reached.
/home/geovana23021/anaconda3/envs/ilumpy/lib/python3.11/site-packages/sklearn/metrics/_regression.py:483: FutureWarning: 'squared' is deprecated in version 1.4 and will be removed in 1.6. To calculate the root mean squared error, use the function'root_mean_squared_error'.
  warnings.warn(
[I 2024-05-20 19:57:36,078] Trial 39 finished with value: 1.0379122968914254 and parameters: {'num_neuronios': 107, 'num_camadas': 4, 'funcao_de_ativacao': 'Sigmoide', 'taxa_de_aprendizado': 4.366455918246457e-05, 'otimizador': 'SGD'}. Best is trial 33 with value: 0.8451216732380793.
GPU available: True (cuda), used: True
TPU available: False, using: 0 TPU cores
IPU available: False, using: 0 IPUs
HPU available: False, using: 0 HPUs
LOCAL_RANK: 0 - CUDA_VISIBLE_DEVICES: [0]

  | Name          | Type       | Params
---------------------------------------------
0 | todas_camadas | Sequential | 257 K 
---------------------------------------------
257 K     Trainable params
0         Non-trainable params
257 K     Total params
1.031     Total estimated model params size (MB)
SLURM auto-requeueing enabled. Setting signal handlers.
/home/geovana23021/anaconda3/envs/ilumpy/lib/python3.11/site-packages/lightning/pytorch/loops/fit_loop.py:298: The number of training batches (13) is smaller than the logging interval Trainer(log_every_n_steps=50). Set a lower value for log_every_n_steps if you want to see logs for the training epoch.
`Trainer.fit` stopped: `max_epochs=55` reached.
/home/geovana23021/anaconda3/envs/ilumpy/lib/python3.11/site-packages/sklearn/metrics/_regression.py:483: FutureWarning: 'squared' is deprecated in version 1.4 and will be removed in 1.6. To calculate the root mean squared error, use the function'root_mean_squared_error'.
  warnings.warn(
[I 2024-05-20 19:57:55,957] Trial 40 finished with value: 0.9164998443494199 and parameters: {'num_neuronios': 281, 'num_camadas': 4, 'funcao_de_ativacao': 'LeakyReLU', 'taxa_de_aprendizado': 0.0059692114604084755, 'otimizador': 'ADAM'}. Best is trial 33 with value: 0.8451216732380793.
GPU available: True (cuda), used: True
TPU available: False, using: 0 TPU cores
IPU available: False, using: 0 IPUs
HPU available: False, using: 0 HPUs
LOCAL_RANK: 0 - CUDA_VISIBLE_DEVICES: [0]

  | Name          | Type       | Params
---------------------------------------------
0 | todas_camadas | Sequential | 209 K 
---------------------------------------------
209 K     Trainable params
0         Non-trainable params
209 K     Total params
0.837     Total estimated model params size (MB)
SLURM auto-requeueing enabled. Setting signal handlers.
/home/geovana23021/anaconda3/envs/ilumpy/lib/python3.11/site-packages/lightning/pytorch/loops/fit_loop.py:298: The number of training batches (13) is smaller than the logging interval Trainer(log_every_n_steps=50). Set a lower value for log_every_n_steps if you want to see logs for the training epoch.
`Trainer.fit` stopped: `max_epochs=55` reached.
/home/geovana23021/anaconda3/envs/ilumpy/lib/python3.11/site-packages/sklearn/metrics/_regression.py:483: FutureWarning: 'squared' is deprecated in version 1.4 and will be removed in 1.6. To calculate the root mean squared error, use the function'root_mean_squared_error'.
  warnings.warn(
