[I 2024-05-20 20:06:48,624] Trial 69 finished with value: 0.8536452450479647 and parameters: {'num_neuronios': 143, 'num_camadas': 4, 'funcao_de_ativacao': 'Sigmoide', 'taxa_de_aprendizado': 0.001321089931626269, 'otimizador': 'ADAM'}. Best is trial 62 with value: 0.8432705982818476.
GPU available: True (cuda), used: True
TPU available: False, using: 0 TPU cores
IPU available: False, using: 0 IPUs
HPU available: False, using: 0 HPUs
LOCAL_RANK: 0 - CUDA_VISIBLE_DEVICES: [0]

  | Name          | Type       | Params
---------------------------------------------
0 | todas_camadas | Sequential | 29.1 K
---------------------------------------------
29.1 K    Trainable params
0         Non-trainable params
29.1 K    Total params
0.117     Total estimated model params size (MB)
SLURM auto-requeueing enabled. Setting signal handlers.
/home/geovana23021/anaconda3/envs/ilumpy/lib/python3.11/site-packages/lightning/pytorch/loops/fit_loop.py:298: The number of training batches (13) is smaller than the logging interval Trainer(log_every_n_steps=50). Set a lower value for log_every_n_steps if you want to see logs for the training epoch.
`Trainer.fit` stopped: `max_epochs=55` reached.
/home/geovana23021/anaconda3/envs/ilumpy/lib/python3.11/site-packages/sklearn/metrics/_regression.py:483: FutureWarning: 'squared' is deprecated in version 1.4 and will be removed in 1.6. To calculate the root mean squared error, use the function'root_mean_squared_error'.
  warnings.warn(
[I 2024-05-20 20:07:04,363] Trial 70 finished with value: 0.9849611981056331 and parameters: {'num_neuronios': 87, 'num_camadas': 4, 'funcao_de_ativacao': 'Tangente_Hiperbólica', 'taxa_de_aprendizado': 0.0136261447128857, 'otimizador': 'ADAM'}. Best is trial 62 with value: 0.8432705982818476.
GPU available: True (cuda), used: True
TPU available: False, using: 0 TPU cores
IPU available: False, using: 0 IPUs
HPU available: False, using: 0 HPUs
LOCAL_RANK: 0 - CUDA_VISIBLE_DEVICES: [0]

  | Name          | Type       | Params
---------------------------------------------
0 | todas_camadas | Sequential | 127 K 
---------------------------------------------
127 K     Trainable params
0         Non-trainable params
127 K     Total params
0.509     Total estimated model params size (MB)
SLURM auto-requeueing enabled. Setting signal handlers.
/home/geovana23021/anaconda3/envs/ilumpy/lib/python3.11/site-packages/lightning/pytorch/loops/fit_loop.py:298: The number of training batches (13) is smaller than the logging interval Trainer(log_every_n_steps=50). Set a lower value for log_every_n_steps if you want to see logs for the training epoch.
`Trainer.fit` stopped: `max_epochs=55` reached.
/home/geovana23021/anaconda3/envs/ilumpy/lib/python3.11/site-packages/sklearn/metrics/_regression.py:483: FutureWarning: 'squared' is deprecated in version 1.4 and will be removed in 1.6. To calculate the root mean squared error, use the function'root_mean_squared_error'.
  warnings.warn(
[I 2024-05-20 20:07:22,868] Trial 71 finished with value: 0.8724379665875348 and parameters: {'num_neuronios': 194, 'num_camadas': 4, 'funcao_de_ativacao': 'Sigmoide', 'taxa_de_aprendizado': 0.0007376463746880468, 'otimizador': 'ADAM'}. Best is trial 62 with value: 0.8432705982818476.
GPU available: True (cuda), used: True
TPU available: False, using: 0 TPU cores
IPU available: False, using: 0 IPUs
HPU available: False, using: 0 HPUs
LOCAL_RANK: 0 - CUDA_VISIBLE_DEVICES: [0]

  | Name          | Type       | Params
---------------------------------------------
0 | todas_camadas | Sequential | 73.8 K
---------------------------------------------
73.8 K    Trainable params
0         Non-trainable params
73.8 K    Total params
0.295     Total estimated model params size (MB)
SLURM auto-requeueing enabled. Setting signal handlers.
/home/geovana23021/anaconda3/envs/ilumpy/lib/python3.11/site-packages/lightning/pytorch/loops/fit_loop.py:298: The number of training batches (13) is smaller than the logging interval Trainer(log_every_n_steps=50). Set a lower value for log_every_n_steps if you want to see logs for the training epoch.
`Trainer.fit` stopped: `max_epochs=55` reached.
/home/geovana23021/anaconda3/envs/ilumpy/lib/python3.11/site-packages/sklearn/metrics/_regression.py:483: FutureWarning: 'squared' is deprecated in version 1.4 and will be removed in 1.6. To calculate the root mean squared error, use the function'root_mean_squared_error'.
  warnings.warn(
[I 2024-05-20 20:07:40,424] Trial 72 finished with value: 0.8499949659622649 and parameters: {'num_neuronios': 145, 'num_camadas': 4, 'funcao_de_ativacao': 'Sigmoide', 'taxa_de_aprendizado': 0.0017645717727716977, 'otimizador': 'ADAM'}. Best is trial 62 with value: 0.8432705982818476.
GPU available: True (cuda), used: True
TPU available: False, using: 0 TPU cores
IPU available: False, using: 0 IPUs
HPU available: False, using: 0 HPUs
LOCAL_RANK: 0 - CUDA_VISIBLE_DEVICES: [0]

  | Name          | Type       | Params
---------------------------------------------
0 | todas_camadas | Sequential | 193 K 
---------------------------------------------
193 K     Trainable params
0         Non-trainable params
193 K     Total params
0.774     Total estimated model params size (MB)
SLURM auto-requeueing enabled. Setting signal handlers.
/home/geovana23021/anaconda3/envs/ilumpy/lib/python3.11/site-packages/lightning/pytorch/loops/fit_loop.py:298: The number of training batches (13) is smaller than the logging interval Trainer(log_every_n_steps=50). Set a lower value for log_every_n_steps if you want to see logs for the training epoch.
`Trainer.fit` stopped: `max_epochs=55` reached.
/home/geovana23021/anaconda3/envs/ilumpy/lib/python3.11/site-packages/sklearn/metrics/_regression.py:483: FutureWarning: 'squared' is deprecated in version 1.4 and will be removed in 1.6. To calculate the root mean squared error, use the function'root_mean_squared_error'.
  warnings.warn(
[I 2024-05-20 20:07:59,640] Trial 73 finished with value: 0.8753329792336361 and parameters: {'num_neuronios': 242, 'num_camadas': 4, 'funcao_de_ativacao': 'Sigmoide', 'taxa_de_aprendizado': 0.0035001908595138935, 'otimizador': 'ADAM'}. Best is trial 62 with value: 0.8432705982818476.
GPU available: True (cuda), used: True
TPU available: False, using: 0 TPU cores
IPU available: False, using: 0 IPUs
HPU available: False, using: 0 HPUs
LOCAL_RANK: 0 - CUDA_VISIBLE_DEVICES: [0]

  | Name          | Type       | Params
---------------------------------------------
0 | todas_camadas | Sequential | 101 K 
---------------------------------------------
101 K     Trainable params
0         Non-trainable params
101 K     Total params
0.406     Total estimated model params size (MB)
SLURM auto-requeueing enabled. Setting signal handlers.
/home/geovana23021/anaconda3/envs/ilumpy/lib/python3.11/site-packages/lightning/pytorch/loops/fit_loop.py:298: The number of training batches (13) is smaller than the logging interval Trainer(log_every_n_steps=50). Set a lower value for log_every_n_steps if you want to see logs for the training epoch.
`Trainer.fit` stopped: `max_epochs=55` reached.
/home/geovana23021/anaconda3/envs/ilumpy/lib/python3.11/site-packages/sklearn/metrics/_regression.py:483: FutureWarning: 'squared' is deprecated in version 1.4 and will be removed in 1.6. To calculate the root mean squared error, use the function'root_mean_squared_error'.
  warnings.warn(
[I 2024-05-20 20:08:18,624] Trial 74 finished with value: 0.8532127998421064 and parameters: {'num_neuronios': 172, 'num_camadas': 4, 'funcao_de_ativacao': 'Sigmoide', 'taxa_de_aprendizado': 0.004617325392229313, 'otimizador': 'ADAM'}. Best is trial 62 with value: 0.8432705982818476.
GPU available: True (cuda), used: True
TPU available: False, using: 0 TPU cores
IPU available: False, using: 0 IPUs
HPU available: False, using: 0 HPUs
LOCAL_RANK: 0 - CUDA_VISIBLE_DEVICES: [0]

  | Name          | Type       | Params
---------------------------------------------
0 | todas_camadas | Sequential | 162 K 
---------------------------------------------
162 K     Trainable params
0         Non-trainable params
162 K     Total params
0.652     Total estimated model params size (MB)
SLURM auto-requeueing enabled. Setting signal handlers.
/home/geovana23021/anaconda3/envs/ilumpy/lib/python3.11/site-packages/lightning/pytorch/loops/fit_loop.py:298: The number of training batches (13) is smaller than the logging interval Trainer(log_every_n_steps=50). Set a lower value for log_every_n_steps if you want to see logs for the training epoch.
`Trainer.fit` stopped: `max_epochs=55` reached.
/home/geovana23021/anaconda3/envs/ilumpy/lib/python3.11/site-packages/sklearn/metrics/_regression.py:483: FutureWarning: 'squared' is deprecated in version 1.4 and will be removed in 1.6. To calculate the root mean squared error, use the function'root_mean_squared_error'.
  warnings.warn(
[I 2024-05-20 20:08:38,122] Trial 75 finished with value: 1.3693347362781376 and parameters: {'num_neuronios': 221, 'num_camadas': 4, 'funcao_de_ativacao': 'Sigmoide', 'taxa_de_aprendizado': 1.1045097961212142e-06, 'otimizador': 'ADAM'}. Best is trial 62 with value: 0.8432705982818476.
GPU available: True (cuda), used: True
TPU available: False, using: 0 TPU cores
IPU available: False, using: 0 IPUs
HPU available: False, using: 0 HPUs
LOCAL_RANK: 0 - CUDA_VISIBLE_DEVICES: [0]

  | Name          | Type       | Params
---------------------------------------------
0 | todas_camadas | Sequential | 49.0 K
---------------------------------------------
49.0 K    Trainable params
0         Non-trainable params
49.0 K    Total params
0.196     Total estimated model params size (MB)
SLURM auto-requeueing enabled. Setting signal handlers.
/home/geovana23021/anaconda3/envs/ilumpy/lib/python3.11/site-packages/lightning/pytorch/loops/fit_loop.py:298: The number of training batches (13) is smaller than the logging interval Trainer(log_every_n_steps=50). Set a lower value for log_every_n_steps if you want to see logs for the training epoch.
`Trainer.fit` stopped: `max_epochs=55` reached.
/home/geovana23021/anaconda3/envs/ilumpy/lib/python3.11/site-packages/sklearn/metrics/_regression.py:483: FutureWarning: 'squared' is deprecated in version 1.4 and will be removed in 1.6. To calculate the root mean squared error, use the function'root_mean_squared_error'.
  warnings.warn(
[I 2024-05-20 20:08:55,292] Trial 76 finished with value: 0.8124891566920303 and parameters: {'num_neuronios': 116, 'num_camadas': 4, 'funcao_de_ativacao': 'ELU', 'taxa_de_aprendizado': 0.0017877318356991326, 'otimizador': 'ADAM'}. Best is trial 76 with value: 0.8124891566920303.
GPU available: True (cuda), used: True
TPU available: False, using: 0 TPU cores
IPU available: False, using: 0 IPUs
HPU available: False, using: 0 HPUs
LOCAL_RANK: 0 - CUDA_VISIBLE_DEVICES: [0]

  | Name          | Type       | Params
---------------------------------------------
0 | todas_camadas | Sequential | 49.7 K
---------------------------------------------
49.7 K    Trainable params
0         Non-trainable params
49.7 K    Total params
0.199     Total estimated model params size (MB)
SLURM auto-requeueing enabled. Setting signal handlers.
/home/geovana23021/anaconda3/envs/ilumpy/lib/python3.11/site-packages/lightning/pytorch/loops/fit_loop.py:298: The number of training batches (13) is smaller than the logging interval Trainer(log_every_n_steps=50). Set a lower value for log_every_n_steps if you want to see logs for the training epoch.
`Trainer.fit` stopped: `max_epochs=55` reached.
/home/geovana23021/anaconda3/envs/ilumpy/lib/python3.11/site-packages/sklearn/metrics/_regression.py:483: FutureWarning: 'squared' is deprecated in version 1.4 and will be removed in 1.6. To calculate the root mean squared error, use the function'root_mean_squared_error'.
  warnings.warn(
[I 2024-05-20 20:09:10,782] Trial 77 finished with value: 1.0473606782527327 and parameters: {'num_neuronios': 117, 'num_camadas': 4, 'funcao_de_ativacao': 'ELU', 'taxa_de_aprendizado': 0.0020937323475448584, 'otimizador': 'SGD'}. Best is trial 76 with value: 0.8124891566920303.
GPU available: True (cuda), used: True
TPU available: False, using: 0 TPU cores
IPU available: False, using: 0 IPUs
HPU available: False, using: 0 HPUs
LOCAL_RANK: 0 - CUDA_VISIBLE_DEVICES: [0]

  | Name          | Type       | Params
---------------------------------------------
0 | todas_camadas | Sequential | 14.4 K
---------------------------------------------
14.4 K    Trainable params
0         Non-trainable params
14.4 K    Total params
0.058     Total estimated model params size (MB)
SLURM auto-requeueing enabled. Setting signal handlers.
/home/geovana23021/anaconda3/envs/ilumpy/lib/python3.11/site-packages/lightning/pytorch/loops/fit_loop.py:298: The number of training batches (13) is smaller than the logging interval Trainer(log_every_n_steps=50). Set a lower value for log_every_n_steps if you want to see logs for the training epoch.
`Trainer.fit` stopped: `max_epochs=55` reached.
/home/geovana23021/anaconda3/envs/ilumpy/lib/python3.11/site-packages/sklearn/metrics/_regression.py:483: FutureWarning: 'squared' is deprecated in version 1.4 and will be removed in 1.6. To calculate the root mean squared error, use the function'root_mean_squared_error'.
  warnings.warn(
[I 2024-05-20 20:09:26,149] Trial 78 finished with value: 0.887395362942705 and parameters: {'num_neuronios': 58, 'num_camadas': 4, 'funcao_de_ativacao': 'ELU', 'taxa_de_aprendizado': 0.0003598441220204762, 'otimizador': 'RMSPROP'}. Best is trial 76 with value: 0.8124891566920303.
GPU available: True (cuda), used: True
TPU available: False, using: 0 TPU cores
IPU available: False, using: 0 IPUs
HPU available: False, using: 0 HPUs
LOCAL_RANK: 0 - CUDA_VISIBLE_DEVICES: [0]

  | Name          | Type       | Params
---------------------------------------------
0 | todas_camadas | Sequential | 80.6 K
---------------------------------------------
80.6 K    Trainable params
0         Non-trainable params
80.6 K    Total params
0.322     Total estimated model params size (MB)
SLURM auto-requeueing enabled. Setting signal handlers.
/home/geovana23021/anaconda3/envs/ilumpy/lib/python3.11/site-packages/lightning/pytorch/loops/fit_loop.py:298: The number of training batches (13) is smaller than the logging interval Trainer(log_every_n_steps=50). Set a lower value for log_every_n_steps if you want to see logs for the training epoch.
`Trainer.fit` stopped: `max_epochs=55` reached.
/home/geovana23021/anaconda3/envs/ilumpy/lib/python3.11/site-packages/sklearn/metrics/_regression.py:483: FutureWarning: 'squared' is deprecated in version 1.4 and will be removed in 1.6. To calculate the root mean squared error, use the function'root_mean_squared_error'.
  warnings.warn(
[I 2024-05-20 20:09:43,820] Trial 79 finished with value: 0.873092603435323 and parameters: {'num_neuronios': 152, 'num_camadas': 4, 'funcao_de_ativacao': 'ELU', 'taxa_de_aprendizado': 0.001119174509244223, 'otimizador': 'ADAM'}. Best is trial 76 with value: 0.8124891566920303.
GPU available: True (cuda), used: True
TPU available: False, using: 0 TPU cores
IPU available: False, using: 0 IPUs
HPU available: False, using: 0 HPUs
LOCAL_RANK: 0 - CUDA_VISIBLE_DEVICES: [0]

  | Name          | Type       | Params
---------------------------------------------
0 | todas_camadas | Sequential | 32.2 K
---------------------------------------------
32.2 K    Trainable params
0         Non-trainable params
32.2 K    Total params
0.129     Total estimated model params size (MB)
SLURM auto-requeueing enabled. Setting signal handlers.
/home/geovana23021/anaconda3/envs/ilumpy/lib/python3.11/site-packages/lightning/pytorch/loops/fit_loop.py:298: The number of training batches (13) is smaller than the logging interval Trainer(log_every_n_steps=50). Set a lower value for log_every_n_steps if you want to see logs for the training epoch.
`Trainer.fit` stopped: `max_epochs=55` reached.
/home/geovana23021/anaconda3/envs/ilumpy/lib/python3.11/site-packages/sklearn/metrics/_regression.py:483: FutureWarning: 'squared' is deprecated in version 1.4 and will be removed in 1.6. To calculate the root mean squared error, use the function'root_mean_squared_error'.
  warnings.warn(
[I 2024-05-20 20:09:59,576] Trial 80 finished with value: 0.7868210833063772 and parameters: {'num_neuronios': 92, 'num_camadas': 4, 'funcao_de_ativacao': 'ELU', 'taxa_de_aprendizado': 0.008570377735708243, 'otimizador': 'ADAM'}. Best is trial 80 with value: 0.7868210833063772.
GPU available: True (cuda), used: True
TPU available: False, using: 0 TPU cores
IPU available: False, using: 0 IPUs
HPU available: False, using: 0 HPUs
LOCAL_RANK: 0 - CUDA_VISIBLE_DEVICES: [0]

  | Name          | Type       | Params
---------------------------------------------
0 | todas_camadas | Sequential | 34.8 K
---------------------------------------------
34.8 K    Trainable params
0         Non-trainable params
34.8 K    Total params
0.139     Total estimated model params size (MB)
SLURM auto-requeueing enabled. Setting signal handlers.
/home/geovana23021/anaconda3/envs/ilumpy/lib/python3.11/site-packages/lightning/pytorch/loops/fit_loop.py:298: The number of training batches (13) is smaller than the logging interval Trainer(log_every_n_steps=50). Set a lower value for log_every_n_steps if you want to see logs for the training epoch.
`Trainer.fit` stopped: `max_epochs=55` reached.
/home/geovana23021/anaconda3/envs/ilumpy/lib/python3.11/site-packages/sklearn/metrics/_regression.py:483: FutureWarning: 'squared' is deprecated in version 1.4 and will be removed in 1.6. To calculate the root mean squared error, use the function'root_mean_squared_error'.
  warnings.warn(
[I 2024-05-20 20:10:16,019] Trial 81 finished with value: 0.8598396966132393 and parameters: {'num_neuronios': 96, 'num_camadas': 4, 'funcao_de_ativacao': 'ELU', 'taxa_de_aprendizado': 0.008064154226455221, 'otimizador': 'ADAM'}. Best is trial 80 with value: 0.7868210833063772.
GPU available: True (cuda), used: True
TPU available: False, using: 0 TPU cores
IPU available: False, using: 0 IPUs
HPU available: False, using: 0 HPUs
LOCAL_RANK: 0 - CUDA_VISIBLE_DEVICES: [0]

  | Name          | Type       | Params
---------------------------------------------
0 | todas_camadas | Sequential | 17.5 K
---------------------------------------------
17.5 K    Trainable params
0         Non-trainable params
17.5 K    Total params
0.070     Total estimated model params size (MB)
SLURM auto-requeueing enabled. Setting signal handlers.
/home/geovana23021/anaconda3/envs/ilumpy/lib/python3.11/site-packages/lightning/pytorch/loops/fit_loop.py:298: The number of training batches (13) is smaller than the logging interval Trainer(log_every_n_steps=50). Set a lower value for log_every_n_steps if you want to see logs for the training epoch.
`Trainer.fit` stopped: `max_epochs=55` reached.
/home/geovana23021/anaconda3/envs/ilumpy/lib/python3.11/site-packages/sklearn/metrics/_regression.py:483: FutureWarning: 'squared' is deprecated in version 1.4 and will be removed in 1.6. To calculate the root mean squared error, use the function'root_mean_squared_error'.
  warnings.warn(
[I 2024-05-20 20:10:31,583] Trial 82 finished with value: 0.8982268449507708 and parameters: {'num_neuronios': 65, 'num_camadas': 4, 'funcao_de_ativacao': 'ELU', 'taxa_de_aprendizado': 0.03041105621929953, 'otimizador': 'ADAM'}. Best is trial 80 with value: 0.7868210833063772.
GPU available: True (cuda), used: True
TPU available: False, using: 0 TPU cores
IPU available: False, using: 0 IPUs
HPU available: False, using: 0 HPUs
LOCAL_RANK: 0 - CUDA_VISIBLE_DEVICES: [0]

  | Name          | Type       | Params
---------------------------------------------
0 | todas_camadas | Sequential | 25.7 K
---------------------------------------------
25.7 K    Trainable params
0         Non-trainable params
25.7 K    Total params
0.103     Total estimated model params size (MB)
SLURM auto-requeueing enabled. Setting signal handlers.
/home/geovana23021/anaconda3/envs/ilumpy/lib/python3.11/site-packages/lightning/pytorch/loops/fit_loop.py:298: The number of training batches (13) is smaller than the logging interval Trainer(log_every_n_steps=50). Set a lower value for log_every_n_steps if you want to see logs for the training epoch.
`Trainer.fit` stopped: `max_epochs=55` reached.
/home/geovana23021/anaconda3/envs/ilumpy/lib/python3.11/site-packages/sklearn/metrics/_regression.py:483: FutureWarning: 'squared' is deprecated in version 1.4 and will be removed in 1.6. To calculate the root mean squared error, use the function'root_mean_squared_error'.
  warnings.warn(
