[I 2024-05-20 20:10:47,400] Trial 83 finished with value: 0.7936196988892458 and parameters: {'num_neuronios': 81, 'num_camadas': 4, 'funcao_de_ativacao': 'ELU', 'taxa_de_aprendizado': 0.00465250620015821, 'otimizador': 'ADAM'}. Best is trial 80 with value: 0.7868210833063772.
GPU available: True (cuda), used: True
TPU available: False, using: 0 TPU cores
IPU available: False, using: 0 IPUs
HPU available: False, using: 0 HPUs
LOCAL_RANK: 0 - CUDA_VISIBLE_DEVICES: [0]

  | Name          | Type       | Params
---------------------------------------------
0 | todas_camadas | Sequential | 27.4 K
---------------------------------------------
27.4 K    Trainable params
0         Non-trainable params
27.4 K    Total params
0.110     Total estimated model params size (MB)
SLURM auto-requeueing enabled. Setting signal handlers.
/home/geovana23021/anaconda3/envs/ilumpy/lib/python3.11/site-packages/lightning/pytorch/loops/fit_loop.py:298: The number of training batches (13) is smaller than the logging interval Trainer(log_every_n_steps=50). Set a lower value for log_every_n_steps if you want to see logs for the training epoch.
`Trainer.fit` stopped: `max_epochs=55` reached.
/home/geovana23021/anaconda3/envs/ilumpy/lib/python3.11/site-packages/sklearn/metrics/_regression.py:483: FutureWarning: 'squared' is deprecated in version 1.4 and will be removed in 1.6. To calculate the root mean squared error, use the function'root_mean_squared_error'.
  warnings.warn(
[I 2024-05-20 20:11:03,515] Trial 84 finished with value: 0.7725181894480123 and parameters: {'num_neuronios': 84, 'num_camadas': 4, 'funcao_de_ativacao': 'ELU', 'taxa_de_aprendizado': 0.005203233741448786, 'otimizador': 'ADAM'}. Best is trial 84 with value: 0.7725181894480123.
GPU available: True (cuda), used: True
TPU available: False, using: 0 TPU cores
IPU available: False, using: 0 IPUs
HPU available: False, using: 0 HPUs
LOCAL_RANK: 0 - CUDA_VISIBLE_DEVICES: [0]

  | Name          | Type       | Params
---------------------------------------------
0 | todas_camadas | Sequential | 20.4 K
---------------------------------------------
20.4 K    Trainable params
0         Non-trainable params
20.4 K    Total params
0.082     Total estimated model params size (MB)
SLURM auto-requeueing enabled. Setting signal handlers.
/home/geovana23021/anaconda3/envs/ilumpy/lib/python3.11/site-packages/lightning/pytorch/loops/fit_loop.py:298: The number of training batches (13) is smaller than the logging interval Trainer(log_every_n_steps=50). Set a lower value for log_every_n_steps if you want to see logs for the training epoch.
`Trainer.fit` stopped: `max_epochs=55` reached.
/home/geovana23021/anaconda3/envs/ilumpy/lib/python3.11/site-packages/sklearn/metrics/_regression.py:483: FutureWarning: 'squared' is deprecated in version 1.4 and will be removed in 1.6. To calculate the root mean squared error, use the function'root_mean_squared_error'.
  warnings.warn(
[I 2024-05-20 20:11:19,281] Trial 85 finished with value: 0.879689855423024 and parameters: {'num_neuronios': 71, 'num_camadas': 4, 'funcao_de_ativacao': 'ELU', 'taxa_de_aprendizado': 0.00547861500480747, 'otimizador': 'ADAM'}. Best is trial 84 with value: 0.7725181894480123.
GPU available: True (cuda), used: True
TPU available: False, using: 0 TPU cores
IPU available: False, using: 0 IPUs
HPU available: False, using: 0 HPUs
LOCAL_RANK: 0 - CUDA_VISIBLE_DEVICES: [0]

  | Name          | Type       | Params
---------------------------------------------
0 | todas_camadas | Sequential | 8.7 K 
---------------------------------------------
8.7 K     Trainable params
0         Non-trainable params
8.7 K     Total params
0.035     Total estimated model params size (MB)
SLURM auto-requeueing enabled. Setting signal handlers.
/home/geovana23021/anaconda3/envs/ilumpy/lib/python3.11/site-packages/lightning/pytorch/loops/fit_loop.py:298: The number of training batches (13) is smaller than the logging interval Trainer(log_every_n_steps=50). Set a lower value for log_every_n_steps if you want to see logs for the training epoch.
`Trainer.fit` stopped: `max_epochs=55` reached.
/home/geovana23021/anaconda3/envs/ilumpy/lib/python3.11/site-packages/sklearn/metrics/_regression.py:483: FutureWarning: 'squared' is deprecated in version 1.4 and will be removed in 1.6. To calculate the root mean squared error, use the function'root_mean_squared_error'.
  warnings.warn(
[I 2024-05-20 20:11:34,876] Trial 86 finished with value: 0.830311749255933 and parameters: {'num_neuronios': 43, 'num_camadas': 4, 'funcao_de_ativacao': 'ELU', 'taxa_de_aprendizado': 0.01193522059061575, 'otimizador': 'ADAM'}. Best is trial 84 with value: 0.7725181894480123.
GPU available: True (cuda), used: True
TPU available: False, using: 0 TPU cores
IPU available: False, using: 0 IPUs
HPU available: False, using: 0 HPUs
LOCAL_RANK: 0 - CUDA_VISIBLE_DEVICES: [0]

  | Name          | Type       | Params
---------------------------------------------
0 | todas_camadas | Sequential | 6.0 K 
---------------------------------------------
6.0 K     Trainable params
0         Non-trainable params
6.0 K     Total params
0.024     Total estimated model params size (MB)
SLURM auto-requeueing enabled. Setting signal handlers.
/home/geovana23021/anaconda3/envs/ilumpy/lib/python3.11/site-packages/lightning/pytorch/loops/fit_loop.py:298: The number of training batches (13) is smaller than the logging interval Trainer(log_every_n_steps=50). Set a lower value for log_every_n_steps if you want to see logs for the training epoch.
`Trainer.fit` stopped: `max_epochs=55` reached.
/home/geovana23021/anaconda3/envs/ilumpy/lib/python3.11/site-packages/sklearn/metrics/_regression.py:483: FutureWarning: 'squared' is deprecated in version 1.4 and will be removed in 1.6. To calculate the root mean squared error, use the function'root_mean_squared_error'.
  warnings.warn(
[I 2024-05-20 20:11:50,842] Trial 87 finished with value: 0.7800373216422894 and parameters: {'num_neuronios': 34, 'num_camadas': 4, 'funcao_de_ativacao': 'ELU', 'taxa_de_aprendizado': 0.029068920833421948, 'otimizador': 'ADAM'}. Best is trial 84 with value: 0.7725181894480123.
GPU available: True (cuda), used: True
TPU available: False, using: 0 TPU cores
IPU available: False, using: 0 IPUs
HPU available: False, using: 0 HPUs
LOCAL_RANK: 0 - CUDA_VISIBLE_DEVICES: [0]

  | Name          | Type       | Params
---------------------------------------------
0 | todas_camadas | Sequential | 8.1 K 
---------------------------------------------
8.1 K     Trainable params
0         Non-trainable params
8.1 K     Total params
0.032     Total estimated model params size (MB)
SLURM auto-requeueing enabled. Setting signal handlers.
/home/geovana23021/anaconda3/envs/ilumpy/lib/python3.11/site-packages/lightning/pytorch/loops/fit_loop.py:298: The number of training batches (13) is smaller than the logging interval Trainer(log_every_n_steps=50). Set a lower value for log_every_n_steps if you want to see logs for the training epoch.
`Trainer.fit` stopped: `max_epochs=55` reached.
/home/geovana23021/anaconda3/envs/ilumpy/lib/python3.11/site-packages/sklearn/metrics/_regression.py:483: FutureWarning: 'squared' is deprecated in version 1.4 and will be removed in 1.6. To calculate the root mean squared error, use the function'root_mean_squared_error'.
  warnings.warn(
[I 2024-05-20 20:12:06,485] Trial 88 finished with value: 0.9797926353222279 and parameters: {'num_neuronios': 41, 'num_camadas': 4, 'funcao_de_ativacao': 'ELU', 'taxa_de_aprendizado': 0.07548976276658818, 'otimizador': 'ADAM'}. Best is trial 84 with value: 0.7725181894480123.
GPU available: True (cuda), used: True
TPU available: False, using: 0 TPU cores
IPU available: False, using: 0 IPUs
HPU available: False, using: 0 HPUs
LOCAL_RANK: 0 - CUDA_VISIBLE_DEVICES: [0]

  | Name          | Type       | Params
---------------------------------------------
0 | todas_camadas | Sequential | 10.5 K
---------------------------------------------
10.5 K    Trainable params
0         Non-trainable params
10.5 K    Total params
0.042     Total estimated model params size (MB)
SLURM auto-requeueing enabled. Setting signal handlers.
/home/geovana23021/anaconda3/envs/ilumpy/lib/python3.11/site-packages/lightning/pytorch/loops/fit_loop.py:298: The number of training batches (13) is smaller than the logging interval Trainer(log_every_n_steps=50). Set a lower value for log_every_n_steps if you want to see logs for the training epoch.
`Trainer.fit` stopped: `max_epochs=55` reached.
/home/geovana23021/anaconda3/envs/ilumpy/lib/python3.11/site-packages/sklearn/metrics/_regression.py:483: FutureWarning: 'squared' is deprecated in version 1.4 and will be removed in 1.6. To calculate the root mean squared error, use the function'root_mean_squared_error'.
  warnings.warn(
[I 2024-05-20 20:12:22,388] Trial 89 finished with value: 0.8681728578746953 and parameters: {'num_neuronios': 48, 'num_camadas': 4, 'funcao_de_ativacao': 'ELU', 'taxa_de_aprendizado': 0.03331924088035182, 'otimizador': 'ADAM'}. Best is trial 84 with value: 0.7725181894480123.
GPU available: True (cuda), used: True
TPU available: False, using: 0 TPU cores
IPU available: False, using: 0 IPUs
HPU available: False, using: 0 HPUs
LOCAL_RANK: 0 - CUDA_VISIBLE_DEVICES: [0]

  | Name          | Type       | Params
---------------------------------------------
0 | todas_camadas | Sequential | 5.4 K 
---------------------------------------------
5.4 K     Trainable params
0         Non-trainable params
5.4 K     Total params
0.022     Total estimated model params size (MB)
SLURM auto-requeueing enabled. Setting signal handlers.
/home/geovana23021/anaconda3/envs/ilumpy/lib/python3.11/site-packages/lightning/pytorch/loops/fit_loop.py:298: The number of training batches (13) is smaller than the logging interval Trainer(log_every_n_steps=50). Set a lower value for log_every_n_steps if you want to see logs for the training epoch.
`Trainer.fit` stopped: `max_epochs=55` reached.
/home/geovana23021/anaconda3/envs/ilumpy/lib/python3.11/site-packages/sklearn/metrics/_regression.py:483: FutureWarning: 'squared' is deprecated in version 1.4 and will be removed in 1.6. To calculate the root mean squared error, use the function'root_mean_squared_error'.
  warnings.warn(
[I 2024-05-20 20:12:38,208] Trial 90 finished with value: 0.8336954815775482 and parameters: {'num_neuronios': 32, 'num_camadas': 4, 'funcao_de_ativacao': 'ELU', 'taxa_de_aprendizado': 0.020515856129025366, 'otimizador': 'ADAM'}. Best is trial 84 with value: 0.7725181894480123.
GPU available: True (cuda), used: True
TPU available: False, using: 0 TPU cores
IPU available: False, using: 0 IPUs
HPU available: False, using: 0 HPUs
LOCAL_RANK: 0 - CUDA_VISIBLE_DEVICES: [0]

  | Name          | Type       | Params
---------------------------------------------
0 | todas_camadas | Sequential | 6.0 K 
---------------------------------------------
6.0 K     Trainable params
0         Non-trainable params
6.0 K     Total params
0.024     Total estimated model params size (MB)
SLURM auto-requeueing enabled. Setting signal handlers.
/home/geovana23021/anaconda3/envs/ilumpy/lib/python3.11/site-packages/lightning/pytorch/loops/fit_loop.py:298: The number of training batches (13) is smaller than the logging interval Trainer(log_every_n_steps=50). Set a lower value for log_every_n_steps if you want to see logs for the training epoch.
`Trainer.fit` stopped: `max_epochs=55` reached.
/home/geovana23021/anaconda3/envs/ilumpy/lib/python3.11/site-packages/sklearn/metrics/_regression.py:483: FutureWarning: 'squared' is deprecated in version 1.4 and will be removed in 1.6. To calculate the root mean squared error, use the function'root_mean_squared_error'.
  warnings.warn(
[I 2024-05-20 20:12:53,499] Trial 91 finished with value: 0.8412981034481117 and parameters: {'num_neuronios': 34, 'num_camadas': 4, 'funcao_de_ativacao': 'ELU', 'taxa_de_aprendizado': 0.016673937033433738, 'otimizador': 'ADAM'}. Best is trial 84 with value: 0.7725181894480123.
GPU available: True (cuda), used: True
TPU available: False, using: 0 TPU cores
IPU available: False, using: 0 IPUs
HPU available: False, using: 0 HPUs
LOCAL_RANK: 0 - CUDA_VISIBLE_DEVICES: [0]

  | Name          | Type       | Params
---------------------------------------------
0 | todas_camadas | Sequential | 4.9 K 
---------------------------------------------
4.9 K     Trainable params
0         Non-trainable params
4.9 K     Total params
0.020     Total estimated model params size (MB)
SLURM auto-requeueing enabled. Setting signal handlers.
/home/geovana23021/anaconda3/envs/ilumpy/lib/python3.11/site-packages/lightning/pytorch/loops/fit_loop.py:298: The number of training batches (13) is smaller than the logging interval Trainer(log_every_n_steps=50). Set a lower value for log_every_n_steps if you want to see logs for the training epoch.
`Trainer.fit` stopped: `max_epochs=55` reached.
/home/geovana23021/anaconda3/envs/ilumpy/lib/python3.11/site-packages/sklearn/metrics/_regression.py:483: FutureWarning: 'squared' is deprecated in version 1.4 and will be removed in 1.6. To calculate the root mean squared error, use the function'root_mean_squared_error'.
  warnings.warn(
[I 2024-05-20 20:13:08,803] Trial 92 finished with value: 0.8350710128885711 and parameters: {'num_neuronios': 30, 'num_camadas': 4, 'funcao_de_ativacao': 'ELU', 'taxa_de_aprendizado': 0.021052909909516873, 'otimizador': 'ADAM'}. Best is trial 84 with value: 0.7725181894480123.
GPU available: True (cuda), used: True
TPU available: False, using: 0 TPU cores
IPU available: False, using: 0 IPUs
HPU available: False, using: 0 HPUs
LOCAL_RANK: 0 - CUDA_VISIBLE_DEVICES: [0]

  | Name          | Type       | Params
---------------------------------------------
0 | todas_camadas | Sequential | 25.7 K
---------------------------------------------
25.7 K    Trainable params
0         Non-trainable params
25.7 K    Total params
0.103     Total estimated model params size (MB)
SLURM auto-requeueing enabled. Setting signal handlers.
/home/geovana23021/anaconda3/envs/ilumpy/lib/python3.11/site-packages/lightning/pytorch/loops/fit_loop.py:298: The number of training batches (13) is smaller than the logging interval Trainer(log_every_n_steps=50). Set a lower value for log_every_n_steps if you want to see logs for the training epoch.
`Trainer.fit` stopped: `max_epochs=55` reached.
/home/geovana23021/anaconda3/envs/ilumpy/lib/python3.11/site-packages/sklearn/metrics/_regression.py:483: FutureWarning: 'squared' is deprecated in version 1.4 and will be removed in 1.6. To calculate the root mean squared error, use the function'root_mean_squared_error'.
  warnings.warn(
[I 2024-05-20 20:13:24,702] Trial 93 finished with value: 0.8462057790756077 and parameters: {'num_neuronios': 81, 'num_camadas': 4, 'funcao_de_ativacao': 'ELU', 'taxa_de_aprendizado': 0.018155032115856628, 'otimizador': 'ADAM'}. Best is trial 84 with value: 0.7725181894480123.
GPU available: True (cuda), used: True
TPU available: False, using: 0 TPU cores
IPU available: False, using: 0 IPUs
HPU available: False, using: 0 HPUs
LOCAL_RANK: 0 - CUDA_VISIBLE_DEVICES: [0]

  | Name          | Type       | Params
---------------------------------------------
0 | todas_camadas | Sequential | 5.2 K 
---------------------------------------------
5.2 K     Trainable params
0         Non-trainable params
5.2 K     Total params
0.021     Total estimated model params size (MB)
SLURM auto-requeueing enabled. Setting signal handlers.
/home/geovana23021/anaconda3/envs/ilumpy/lib/python3.11/site-packages/lightning/pytorch/loops/fit_loop.py:298: The number of training batches (13) is smaller than the logging interval Trainer(log_every_n_steps=50). Set a lower value for log_every_n_steps if you want to see logs for the training epoch.
`Trainer.fit` stopped: `max_epochs=55` reached.
/home/geovana23021/anaconda3/envs/ilumpy/lib/python3.11/site-packages/sklearn/metrics/_regression.py:483: FutureWarning: 'squared' is deprecated in version 1.4 and will be removed in 1.6. To calculate the root mean squared error, use the function'root_mean_squared_error'.
  warnings.warn(
[I 2024-05-20 20:13:40,143] Trial 94 finished with value: 0.8704483871119455 and parameters: {'num_neuronios': 31, 'num_camadas': 4, 'funcao_de_ativacao': 'ELU', 'taxa_de_aprendizado': 0.045034070761456255, 'otimizador': 'ADAM'}. Best is trial 84 with value: 0.7725181894480123.
GPU available: True (cuda), used: True
TPU available: False, using: 0 TPU cores
IPU available: False, using: 0 IPUs
HPU available: False, using: 0 HPUs
LOCAL_RANK: 0 - CUDA_VISIBLE_DEVICES: [0]

  | Name          | Type       | Params
---------------------------------------------
0 | todas_camadas | Sequential | 15.2 K
---------------------------------------------
15.2 K    Trainable params
0         Non-trainable params
15.2 K    Total params
0.061     Total estimated model params size (MB)
SLURM auto-requeueing enabled. Setting signal handlers.
/home/geovana23021/anaconda3/envs/ilumpy/lib/python3.11/site-packages/lightning/pytorch/loops/fit_loop.py:298: The number of training batches (13) is smaller than the logging interval Trainer(log_every_n_steps=50). Set a lower value for log_every_n_steps if you want to see logs for the training epoch.
`Trainer.fit` stopped: `max_epochs=55` reached.
/home/geovana23021/anaconda3/envs/ilumpy/lib/python3.11/site-packages/sklearn/metrics/_regression.py:483: FutureWarning: 'squared' is deprecated in version 1.4 and will be removed in 1.6. To calculate the root mean squared error, use the function'root_mean_squared_error'.
  warnings.warn(
[I 2024-05-20 20:13:56,003] Trial 95 finished with value: 0.8687966516588587 and parameters: {'num_neuronios': 60, 'num_camadas': 4, 'funcao_de_ativacao': 'ELU', 'taxa_de_aprendizado': 0.02444876458370249, 'otimizador': 'ADAM'}. Best is trial 84 with value: 0.7725181894480123.
GPU available: True (cuda), used: True
TPU available: False, using: 0 TPU cores
IPU available: False, using: 0 IPUs
HPU available: False, using: 0 HPUs
LOCAL_RANK: 0 - CUDA_VISIBLE_DEVICES: [0]

  | Name          | Type       | Params
---------------------------------------------
0 | todas_camadas | Sequential | 10.5 K
---------------------------------------------
10.5 K    Trainable params
0         Non-trainable params
10.5 K    Total params
0.042     Total estimated model params size (MB)
SLURM auto-requeueing enabled. Setting signal handlers.
/home/geovana23021/anaconda3/envs/ilumpy/lib/python3.11/site-packages/lightning/pytorch/loops/fit_loop.py:298: The number of training batches (13) is smaller than the logging interval Trainer(log_every_n_steps=50). Set a lower value for log_every_n_steps if you want to see logs for the training epoch.
`Trainer.fit` stopped: `max_epochs=55` reached.
/home/geovana23021/anaconda3/envs/ilumpy/lib/python3.11/site-packages/sklearn/metrics/_regression.py:483: FutureWarning: 'squared' is deprecated in version 1.4 and will be removed in 1.6. To calculate the root mean squared error, use the function'root_mean_squared_error'.
  warnings.warn(
[I 2024-05-20 20:14:11,898] Trial 96 finished with value: 0.8942993663670089 and parameters: {'num_neuronios': 48, 'num_camadas': 4, 'funcao_de_ativacao': 'ELU', 'taxa_de_aprendizado': 0.013279699063741232, 'otimizador': 'ADAM'}. Best is trial 84 with value: 0.7725181894480123.
GPU available: True (cuda), used: True
TPU available: False, using: 0 TPU cores
IPU available: False, using: 0 IPUs
HPU available: False, using: 0 HPUs
LOCAL_RANK: 0 - CUDA_VISIBLE_DEVICES: [0]

  | Name          | Type       | Params
---------------------------------------------
0 | todas_camadas | Sequential | 5.2 K 
---------------------------------------------
5.2 K     Trainable params
0         Non-trainable params
5.2 K     Total params
0.021     Total estimated model params size (MB)
SLURM auto-requeueing enabled. Setting signal handlers.
/home/geovana23021/anaconda3/envs/ilumpy/lib/python3.11/site-packages/lightning/pytorch/loops/fit_loop.py:298: The number of training batches (13) is smaller than the logging interval Trainer(log_every_n_steps=50). Set a lower value for log_every_n_steps if you want to see logs for the training epoch.
`Trainer.fit` stopped: `max_epochs=55` reached.
/home/geovana23021/anaconda3/envs/ilumpy/lib/python3.11/site-packages/sklearn/metrics/_regression.py:483: FutureWarning: 'squared' is deprecated in version 1.4 and will be removed in 1.6. To calculate the root mean squared error, use the function'root_mean_squared_error'.
  warnings.warn(
